,CMC,Name,Rarity,Type_x,Card Kingdom ($),TCGPlayer ($),Face to Face ($),Cardmarket (€),Cardhoarder (Event Ticket - TIX),Salt,Decks,Inclusion,Mana Cost,Text,Stats,URL
389,5.0,Nesting Dragon,R,Creature,1.79,1.02,1.47,1.28,0.36,0.13,14761.0,0.9,{3}{R}{R},"FlyingLandfall— Whenever a land enters the battlefield under your control, create a 0/2 red Dragon Egg creature token with defender and “When this creature dies, create a 2/2 red Dragon creature token with flying and ‘{R}: This creature gets +1/+0 until end of turn.’”",5/4,https://scryfall.com/card/cmm/245/nesting-dragon
390,3.0,Rakish Heir,U,Creature,0.35,0.13,0.18,0.18,0.02,0.14,14739.0,0.9,{2}{R},"Whenever a Vampire you control deals combat damage to a player, put a +1/+1 counter on it.",2/2,https://scryfall.com/card/voc/149/rakish-heir
391,2.0,Flame Rift,U,Sorcery,0.35,0.11,0.18,0.17,0.03,0.14,14734.0,0.9,{1}{R},Flame Rift deals 4 damage to each player.,,https://scryfall.com/card/mh2/278/flame-rift
392,2.0,Reckless Barbarian,C,Creature,0.35,0.09,0.18,0.11,1.15,0.14,14701.0,0.9,{1}{R},Sacrifice Reckless Barbarian: Add{R}{R}.,2/2,https://scryfall.com/card/hbg/187/reckless-barbarian
393,1.0,Titan's Strength,C,Instant,0.35,0.05,0.11,0.08,0.03,0.1,14687.0,0.9,{R},Target creature gets +3/+1 until end of turn. Scry 1.(Look at the top card of your library. You may put that card on the bottom of your library.),,https://scryfall.com/card/ea1/11/titans-strength
394,3.0,Maddening Hex,R,Enchantment,7.99,4.81,7.36,7.34,4.04,0.41,14624.0,0.9,{1}{R}{R},"Enchant playerWhenever enchanted player casts a noncreature spell, roll a d6. Maddening Hex deals damage to that player equal to the result. Then attach Maddening Hex to another one of your opponents chosen at random.",,https://scryfall.com/card/afc/32/maddening-hex
395,3.0,Repercussion,R,Enchantment,2.79,3.3,2.94,2.22,0.03,0.59,14619.0,0.9,{1}{R}{R},"Whenever a creature is dealt damage, Repercussion deals that much damage to that creature’s controller.",,https://scryfall.com/card/wot/48/repercussion
396,6.0,"Muxus, Goblin Grandee",R,Creature,6.99,4.79,5.89,7.64,19.24,0.43,14582.0,0.9,{4}{R}{R},"When Muxus, Goblin Grandee enters the battlefield, reveal the top six cards of your library. Put all Goblin creature cards with mana value 5 or less from among them onto the battlefield and the rest on the bottom of your library in a random order.Whenever Muxus attacks, it gets +1/+1 until end of turn for each other Goblin you control.",4/4,https://scryfall.com/card/j22/575/muxus-goblin-grandee
397,4.0,Forerunner of the Empire,U,Creature,0.99,1.86,0.73,0.85,0.03,0.15,14576.0,0.9,{3}{R},"When Forerunner of the Empire enters the battlefield, you may search your library for a Dinosaur card, reveal it, then shuffle and put that card on top.Whenever a Dinosaur enters the battlefield under your control, you may have Forerunner of the Empire deal 1 damage to each creature.",1/3,https://scryfall.com/card/rix/102/forerunner-of-the-empire
398,3.0,Storm King's Thunder,M,Instant,2.99,1.93,2.94,1.63,0.65,0.56,14557.0,0.9,{X}{R}{R}{R},"When you cast your next instant or sorcery spell this turn, copy that spell X times. You may choose new targets for the copies.",,https://scryfall.com/card/hbg/189/storm-kings-thunder
399,4.0,"Zada, Hedron Grinder",U,Creature,0.35,0.06,0.18,0.07,0.02,0.52,14556.0,0.9,{3}{R},"Whenever you cast an instant or sorcery spell that targets only Zada, Hedron Grinder, copy that spell for each other creature you control that the spell could target. Each copy targets a different one of those creatures.",3/3,https://scryfall.com/card/cmm/268/zada-hedron-grinder
400,1.0,Goblin War Strike,C,Sorcery,1.49,0.96,2.2,0.38,0.04,0.31,14477.0,0.9,{R},Goblin War Strike deals damage to target player or planeswalker equal to the number of Goblins you control.,,https://scryfall.com/card/scg/96/goblin-war-strike
401,2.0,Goblin Cratermaker,U,Creature,0.35,0.17,0.18,0.11,0.03,0.2,14444.0,0.9,{1}{R},"{1}, Sacrifice Goblin Cratermaker: Choose one —• Goblin Cratermaker deals 2 damage to target creature.• Destroy target colorless nonland permanent.",2/2,https://scryfall.com/card/ltc/218/goblin-cratermaker
402,4.0,Burning Earth,R,Enchantment,2.49,2.17,2.2,1.89,0.02,0.75,14422.0,0.9,{3}{R},"Whenever a player taps a nonbasic land for mana, Burning Earth deals 1 damage to that player.",,https://scryfall.com/card/m14/130/burning-earth
403,2.0,Tavern Scoundrel,C,Creature,0.35,0.04,0.11,0.08,0.03,0.28,14411.0,0.9,{1}{R},"Whenever you win a coin flip, create two Treasure tokens.(They’re artifacts with “{T}, Sacrifice this artifact: Add one mana of any color.”){1},{T}, Sacrifice another permanent: Flip a coin.",1/3,https://scryfall.com/card/mh2/144/tavern-scoundrel
404,4.0,Manaform Hellkite,M,Creature,3.49,1.78,4.05,3.28,0.17,0.25,14380.0,0.9,{2}{R}{R},"FlyingWhenever you cast a noncreature spell, create an X/X red Dragon Illusion creature token with flying and haste, where X is the amount of mana spent to cast that spell. Exile that token at the beginning of the next end step.",4/4,https://scryfall.com/card/dbl/437/manaform-hellkite
405,1.0,Legion Loyalist,R,Creature,7.49,4.59,8.84,6.86,0.06,0.09,14373.0,0.9,{R},"HasteBattalion— Whenever Legion Loyalist and at least two other creatures attack, creatures you control gain first strike and trample until end of turn and can’t be blocked by creature tokens this turn.",1/1,https://scryfall.com/card/gk1/82/legion-loyalist
406,4.0,"Koth, Fire of Resistance",R,Planeswalker,0.69,0.53,0.73,0.29,0.02,0.17,14368.0,0.9,{2}{R}{R},"+2: Search your library for a basic Mountain card, reveal it, put it into your hand, then shuffle.−3: Koth, Fire of Resistance deals damage to target creature equal to the number of Mountains you control.−7: You get an emblem with “Whenever a Mountain enters the battlefield under your control, this emblem deals 4 damage to any target.”",Loyalty: 4,https://scryfall.com/card/one/138/koth-fire-of-resistance
407,3.0,"Squee, Dubious Monarch",R,Creature,0.99,0.81,0.73,0.68,0.3,0.11,14336.0,0.9,{2}{R},"HasteWhenever Squee, Dubious Monarch attacks, create a 1/1 red Goblin creature token that’s tapped and attacking.You may cast Squee, Dubious Monarch from your graveyard by paying{3}{R}and exiling four other cards from your graveyard rather than paying its mana cost.",2/2,https://scryfall.com/card/dmu/146/squee-dubious-monarch
408,6.0,Charmbreaker Devils,R,Creature,0.49,0.11,0.26,0.09,0.02,0.27,14123.0,0.9,{5}{R},"At the beginning of your upkeep, return an instant or sorcery card at random from your graveyard to your hand.Whenever you cast an instant or sorcery spell, Charmbreaker Devils gets +4/+0 until end of turn.",4/4,https://scryfall.com/card/c21/162/charmbreaker-devils
409,3.0,Quicksmith Genius,U,Creature,0.35,0.09,0.18,0.11,0.03,0.18,14118.0,0.9,{2}{R},"Whenever an artifact enters the battlefield under your control, you may discard a card. If you do, draw a card.",3/2,https://scryfall.com/card/c21/178/quicksmith-genius
410,1.0,Ancestral Anger,C,Sorcery,0.35,0.16,0.11,0.3,0.03,0.13,14113.0,0.9,{R},"Target creature gains trample and gets +X/+0 until end of turn, where X is 1 plus the number of cards named Ancestral Anger in your graveyard.Draw a card.",,https://scryfall.com/card/dbl/409/ancestral-anger
411,3.0,Sin Prodder,R,Creature,0.69,0.25,0.55,0.38,0.02,0.15,14075.0,0.9,{2}{R},"MenaceAt the beginning of your upkeep, reveal the top card of your library. Any opponent may have you put that card into your graveyard. If a player does, Sin Prodder deals damage to that player equal to that card’s mana value. Otherwise, put that card into your hand.",3/2,https://scryfall.com/card/sir/177/sin-prodder
412,1.0,Infernal Plunge,C,Sorcery,0.35,0.31,0.36,0.19,0.03,0.21,14073.0,0.9,{R},"As an additional cost to cast this spell, sacrifice a creature.Add{R}{R}{R}.",,https://scryfall.com/card/isd/148/infernal-plunge
413,5.0,Scrap Mastery,R,Sorcery,2.99,2.36,3.68,2.67,0.56,0.2,14072.0,0.9,{3}{R}{R},"Each player exiles all artifact cards from their graveyard, then sacrifices all artifacts they control, then puts all cards they exiled this way onto the battlefield.",,https://scryfall.com/card/cm2/116/scrap-mastery
414,1.0,Overmaster,R,Sorcery,0.79,0.6,0.73,0.75,0.12,0.17,14059.0,0.9,{R},The next instant or sorcery spell you cast this turn can’t be countered.Draw a card.,,https://scryfall.com/card/dmr/132/overmaster
415,1.0,Tempt with Vengeance,R,Sorcery,1.49,0.62,1.1,0.76,0.3,0.3,14014.0,0.9,{X}{R},"Tempting offer— Create X 1/1 red Elemental creature tokens with haste. Each opponent may create X 1/1 red Elemental creature tokens with haste. For each opponent who does, create X 1/1 red Elemental creature tokens with haste.",,https://scryfall.com/card/cmm/263/tempt-with-vengeance
416,2.0,Red Sun's Twilight,R,Sorcery,0.49,0.28,0.26,0.16,0.02,0.3,14012.0,0.9,{X}{R}{R},"Destroy up to X target artifacts. If X is 5 or more, for each artifact destroyed this way, create a token that’s a copy of it. Those tokens gain haste. Exile them at the beginning of the next end step.",,https://scryfall.com/card/one/145/red-suns-twilight
417,1.0,Goldhound,C,Creature,0.35,0.09,0.11,0.14,0.03,0.13,13980.0,0.9,{R},"First strikeMenace(This creature can’t be blocked except by two or more creatures.){T}, Sacrifice Goldhound: Add one mana of any color.",1/1,https://scryfall.com/card/j22/549/goldhound
418,6.0,Worldgorger Dragon,M,Creature,1.29,0.87,0.73,1.21,0.02,1.02,13972.0,0.9,{3}{R}{R}{R},"Flying, trampleWhen Worldgorger Dragon enters the battlefield, exile all other permanents you control.When Worldgorger Dragon leaves the battlefield, return the exiled cards to the battlefield under their owners’ control.",7/7,https://scryfall.com/card/dmr/148/worldgorger-dragon
419,2.0,Battle Cry Goblin,U,Creature,0.59,0.32,0.73,0.47,0.03,0.18,13947.0,0.9,{1}{R},"{1}{R}: Goblins you control get +1/+0 and gain haste until end of turn.Pack tactics— Whenever Battle Cry Goblin attacks, if you attacked with creatures with total power 6 or greater this combat, create a 1/1 red Goblin creature token that’s tapped and attacking.",2/2,https://scryfall.com/card/hbg/175/battle-cry-goblin
420,1.0,Striking Sliver,C,Creature,0.39,0.19,0.36,0.26,0.03,0.17,13916.0,0.9,{R},Sliver creatures you control have first strike.(They deal combat damage before creatures without first strike.),1/1,https://scryfall.com/card/cmm/882/striking-sliver
421,3.0,Goblin War Drums,U,Enchantment,0.35,0.51,0.11,0.1,0.04,0.35,13779.0,0.9,{2}{R},Creatures you control have menace.(They can’t be blocked except by two or more creatures.),,https://scryfall.com/card/a25/133/goblin-war-drums
422,1.0,March of Reckless Joy,R,Instant,0.49,0.19,0.26,0.21,0.01,0.06,13779.0,0.9,{X}{R},"As an additional cost to cast this spell, you may exile any number of red cards from your hand. This spell costs{2}less to cast for each card exiled this way.Exile the top X cards of your library. You may play up to two of those cards until the end of your next turn.",,https://scryfall.com/card/neo/154/march-of-reckless-joy
423,3.0,Patron of the Arts,C,Creature,0.39,0.15,0.36,0.12,0.04,0.02,13718.0,0.9,{2}{R},"When Patron of the Arts enters the battlefield or dies, create a Treasure token.(It’s an artifact with “{T}, Sacrifice this artifact: Add one mana of any color.”)",3/1,https://scryfall.com/card/clb/191/patron-of-the-arts
424,1.0,Warlord's Fury,C,Sorcery,0.35,0.13,0.11,0.16,0.03,0.26,13677.0,0.9,{R},Creatures you control gain first strike until end of turn.Draw a card.,,https://scryfall.com/card/dom/151/warlords-fury
425,3.0,Coastline Marauders,U,Creature,0.79,0.15,0.55,0.19,0.04,0.17,13653.0,0.9,{2}{R},"TrampleWhenever Coastline Marauders attacks, it gets +1/+0 until end of turn for each land defending player controls.Encore{4}{R}{R}({4}{R}{R}, Exile this card from your graveyard: For each opponent, create a token copy that attacks that opponent this turn if able. They gain haste. Sacrifice them at the beginning of the next end step. Activate only as a sorcery.)",0/3,https://scryfall.com/card/cmr/168/coastline-marauders
426,3.0,Act of Treason,C,Sorcery,0.35,0.01,0.11,0.02,0.03,0.29,13564.0,0.8,{2}{R},Gain control of target creature until end of turn. Untap that creature. It gains haste until end of turn.(It can attack and{T}this turn.),,https://scryfall.com/card/jmp/289/act-of-treason
427,5.0,Plargg and Nassari,R,Creature,0.99,0.83,1.1,0.65,0.02,0.45,13525.0,0.8,{3}{R}{R},"At the beginning of your upkeep, each player exiles cards from the top of their library until they exile a nonland card. An opponent chooses a nonland card exiled this way. You may cast up to two spells from among the other cards exiled this way without paying their mana costs.",5/4,https://scryfall.com/card/mat/18/plargg-and-nassari
428,3.0,Anger of the Gods,R,Sorcery,0.39,0.26,0.26,0.33,0.02,0.2,13492.0,0.8,{1}{R}{R},"Anger of the Gods deals 3 damage to each creature. If a creature dealt damage this way would die this turn, exile it instead.",,https://scryfall.com/card/2x2/102/anger-of-the-gods
429,2.0,"Plargg, Dean of Chaos",R,Creature,0.49,0.14,,,0.02,0.33,6094.0,0.8,{1}{R},"{T}, Discard a card: Draw a card.{4}{R},{T}: Reveal cards from the top of your library until you reveal a nonlegendary, nonland card with mana value 3 or less. You may cast that card without paying its mana cost. Put all revealed cards not cast this way on the bottom of your library in a random order.",2/2,https://scryfall.com/card/stx/155/plargg-dean-of-chaos-augusta-dean-of-order
430,6.0,Red Dragon,U,Creature,0.39,0.15,0.55,0.18,0.03,0.05,13357.0,0.8,{4}{R}{R},"FlyingFire Breath— When Red Dragon enters the battlefield, it deals 4 damage to each opponent.",4/4,https://scryfall.com/card/hbg/188/red-dragon
431,6.0,Aurora Phoenix,R,Creature,0.49,0.16,0.26,0.21,1.38,0.26,13355.0,0.8,{4}{R}{R},"FlyingCascade(When you cast this spell, exile cards from the top of your library until you exile a nonland card that costs less. You may cast it without paying its mana cost. Put the exiled cards on the bottom of your library in a random order.)Whenever you cast a spell with cascade, return Aurora Phoenix from your graveyard to your hand.",5/3,https://scryfall.com/card/clb/778/aurora-phoenix
432,4.0,Wildfire Devils,R,Creature,0.69,0.18,0.55,0.12,0.36,0.2,13286.0,0.8,{3}{R},"When Wildfire Devils enters the battlefield and at the beginning of your upkeep, choose a player at random. That player exiles an instant or sorcery card from their graveyard. Copy that card. You may cast the copy without paying its mana cost.",4/2,https://scryfall.com/card/scd/170/wildfire-devils
433,2.0,Warren Instigator,M,Creature,8.99,5.74,8.84,7.18,0.02,0.35,13247.0,0.8,{R}{R},"Double strikeWhenever Warren Instigator deals damage to an opponent, you may put a Goblin creature card from your hand onto the battlefield.",1/1,https://scryfall.com/card/sld/157/warren-instigator
434,4.0,Ardent Elementalist,C,Creature,0.35,0.12,0.11,0.16,0.03,0.1,13234.0,0.8,{3}{R},"When Ardent Elementalist enters the battlefield, return target instant or sorcery card from your graveyard to your hand.",2/1,https://scryfall.com/card/dbl/128/ardent-elementalist
435,3.0,Mana Flare,R,Enchantment,0.49,0.43,0.26,0.22,0.02,0.23,13232.0,0.8,{2}{R},"Whenever a player taps a land for mana, that player adds one mana of any type that land produced.",,https://scryfall.com/card/wot/46/mana-flare
436,4.0,Splinter Twin,R,Enchantment,7.49,7.96,7.36,5.76,0.43,0.73,13170.0,0.8,{2}{R}{R},"Enchant creatureEnchanted creature has “{T}: Create a token that’s a copy of this creature, except it has haste. Exile that token at the beginning of the next end step.”",,https://scryfall.com/card/plist/430/splinter-twin
437,1.0,Voldaren Epicure,C,Creature,0.49,0.26,0.55,0.17,0.03,0.07,13152.0,0.8,{R},"When Voldaren Epicure enters the battlefield, it deals 1 damage to each opponent. Create a Blood token.(It’s an artifact with “{1},{T}, Discard a card, Sacrifice this artifact: Draw a card.”)",1/1,https://scryfall.com/card/dbl/449/voldaren-epicure
438,1.0,Electrickery,C,Instant,0.35,0.27,0.18,0.53,0.03,0.08,13144.0,0.8,{R},"Electrickery deals 1 damage to target creature you don’t control.Overload{1}{R}(You may cast this spell for its overload cost. If you do, change “target” in its text to “each.”)",,https://scryfall.com/card/gk1/29/electrickery
439,3.0,Tunneling Geopede,U,Creature,0.69,0.29,0.73,0.25,0.03,0.1,13136.0,0.8,{2}{R},"Landfall— Whenever a land enters the battlefield under your control, Tunneling Geopede deals 1 damage to each opponent.",3/2,https://scryfall.com/card/bfz/158/tunneling-geopede
440,1.0,Barbarian Class,U,Enchantment,0.35,0.19,0.18,0.14,0.03,0.05,13059.0,0.8,{R},"(Gain the next level as a sorcery to add its ability.)If you would roll one or more dice, instead roll that many dice plus one and ignore the lowest roll.{1}{R}: Level 2Whenever you roll one or more dice, target creature you control gets +2/+0 and gains menace until end of turn.{2}{R}: Level 3Creatures you control have haste.",,https://scryfall.com/card/afr/131/barbarian-class
441,4.0,Life of the Party,R,Creature,0.99,1.08,0.73,0.6,,0.07,12970.0,0.8,{3}{R},"First strike, trample, hasteWhenever Life of the Party attacks, it gets +X/+0 until end of turn, where X is the number of creatures you control.When Life of the Party enters the battlefield, if it’s not a token, each opponent creates a token that’s a copy of it. The tokens are goaded for the rest of the game.(They attack each combat if able and attack a player other than you if able.)",0/1,https://scryfall.com/card/ncc/48/life-of-the-party
442,3.0,"Sarkhan, Fireblood",M,Planeswalker,9.99,9.35,10.31,11.19,0.07,0.24,12965.0,0.8,{1}{R}{R},"+1: You may discard a card. If you do, draw a card.+1: Add two mana in any combination of colors. Spend this mana only to cast Dragon spells.−7: Create four 5/5 red Dragon creature tokens with flying.",Loyalty: 3,https://scryfall.com/card/m19/154/sarkhan-fireblood
443,5.0,Uncivil Unrest,R,Enchantment,6.49,5.36,6.26,3.54,0.1,0.2,12949.0,0.8,{4}{R},"Nontoken creatures you control have riot.(They enter the battlefield with your choice of a +1/+1 counter or haste.)If a creature you control with a +1/+1 counter on it would deal damage to a permanent or player, it deals double that damage instead.",,https://scryfall.com/card/moc/35/uncivil-unrest
444,1.0,Brute Force,C,Instant,0.35,0.11,0.11,0.08,0.03,0.01,12944.0,0.8,{R},Target creature gets +3/+3 until end of turn.,,https://scryfall.com/card/tsr/157/brute-force
445,4.0,Fumiko the Lowblood,R,Creature,0.59,0.36,0.73,0.22,0.02,0.37,12933.0,0.8,{2}{R}{R},"Fumiko the Lowblood has bushido X, where X is the number of attacking creatures.(Whenever this creature blocks or becomes blocked, it gets +X/+X until end of turn.)Creatures your opponents control attack each combat if able.",3/2,https://scryfall.com/card/c20/152/fumiko-the-lowblood
446,6.0,"Chandra, Hope's Beacon",M,Planeswalker,6.49,3.91,6.26,5.51,3.77,0.49,12910.0,0.8,{4}{R}{R},"Whenever you cast an instant or sorcery spell, copy it. You may choose new targets for the copy. This ability triggers only once each turn.+2: Add two mana in any combination of colors.+1: Exile the top five cards of your library. Until the end of your next turn, you may cast an instant or sorcery spell from among those exiled cards.−X: Chandra, Hope’s Beacon deals X damage to each of up to two targets.",Loyalty: 5,https://scryfall.com/card/mom/134/chandra-hopes-beacon
447,5.0,"Mizzix, Replica Rider",R,Creature,2.49,2.1,2.94,1.21,,0.17,6028.0,0.8,{4}{R},"FlyingWhenever you cast a spell from anywhere other than your hand, you may pay{1}{U/R}. If you do, copy that spell and you may choose new targets for the copy. If the copy is a permanent spell, it gains haste and “At the beginning of your end step, sacrifice this permanent.”(A copy of a permanent spell becomes a token.)",4/5,https://scryfall.com/card/j22/35/mizzix-replica-rider
448,2.0,Heart Sliver,C,Creature,1.49,0.94,1.47,0.48,0.06,0.18,12844.0,0.8,{1}{R},All Sliver creatures have haste.,1/1,https://scryfall.com/card/h09/7/heart-sliver
449,3.0,Mogg Salvage,U,Instant,0.35,0.06,0.18,0.08,0.03,0.33,12839.0,0.8,{2}{R},"If an opponent controls an Island and you control a Mountain, you may cast this spell without paying its mana cost.Destroy target artifact.",,https://scryfall.com/card/mh2/282/mogg-salvage
450,7.0,Hellkite Igniter,R,Creature,0.49,0.05,0.26,0.1,0.02,0.14,12818.0,0.8,{5}{R}{R},"Flying, haste{1}{R}: Hellkite Igniter gets +X/+0 until end of turn, where X is the number of artifacts you control.",5/5,https://scryfall.com/card/moc/284/hellkite-igniter
451,4.0,Ill-Tempered Loner,R,Creature,0.59,0.34,,,0.02,0.23,12808.0,0.8,{2}{R}{R},"Whenever Ill-Tempered Loner is dealt damage, it deals that much damage to any target.{1}{R}: Ill-Tempered Loner gets +2/+0 until end of turn.Daybound(If a player casts no spells during their own turn, it becomes night next turn.)",3/3,https://scryfall.com/card/dbl/429/ill-tempered-loner-howlpack-avenger
452,5.0,Backdraft Hellkite,R,Creature,0.49,0.3,0.55,0.26,0.03,0.16,12731.0,0.8,{3}{R}{R},"FlyingWhenever Backdraft Hellkite attacks, each instant and sorcery card in your graveyard gains flashback until end of turn. The flashback cost is equal to its mana cost.",4/4,https://scryfall.com/card/2x2/103/backdraft-hellkite
453,1.0,Beamtown Beatstick,C,Artifact,0.35,0.18,0.11,0.16,0.03,0.05,12728.0,0.8,{R},"Equipped creature gets +1/+0 and has menace.(It can’t be blocked except by two or more creatures.)Whenever equipped creature deals combat damage to a player or battle, create a Treasure token.Equip{2}({2}: Attach to target creature you control. Equip only as a sorcery.)",,https://scryfall.com/card/mom/131/beamtown-beatstick
454,2.0,Finale of Promise,M,Sorcery,2.49,1.52,2.2,1.54,0.3,0.4,12696.0,0.8,{X}{R}{R},"You may cast up to one target instant card and/or up to one target sorcery card from your graveyard each with mana value X or less without paying their mana costs. If a spell cast this way would be put into your graveyard, exile it instead. If X is 10 or more, copy each of those spells twice. You may choose new targets for the copies.",,https://scryfall.com/card/war/127/finale-of-promise
455,2.0,Lightning Strike,C,Instant,0.35,0.08,0.11,0.09,0.02,0.1,12603.0,0.8,{1}{R},Lightning Strike deals 3 damage to any target.,,https://scryfall.com/card/dmu/137/lightning-strike
456,4.0,Industrial Advancement,R,Enchantment,0.59,0.25,0.26,0.53,,0.26,12593.0,0.8,{3}{R},"At the beginning of your end step, you may sacrifice a creature. If you do, look at the top X cards of your library, where X is that creature’s mana value. You may put a creature card from among them onto the battlefield. Put the rest on the bottom of your library in a random order.",,https://scryfall.com/card/ncc/47/industrial-advancement
457,5.0,Jaya Ballard,M,Planeswalker,0.99,0.41,0.73,0.42,0.02,0.16,12584.0,0.8,{2}{R}{R}{R},"+1: Add{R}{R}{R}. Spend this mana only to cast instant or sorcery spells.+1: Discard up to three cards, then draw that many cards.−8: You get an emblem with “You may cast instant and sorcery spells from your graveyard. If a spell cast this way would be put into your graveyard, exile it instead.”",Loyalty: 5,https://scryfall.com/card/c21/175/jaya-ballard
458,8.0,Bogardan Hellkite,M,Creature,0.79,0.22,0.55,0.21,0.02,0.21,12579.0,0.8,{6}{R}{R},"FlashFlyingWhen Bogardan Hellkite enters the battlefield, it deals 5 damage divided as you choose among any number of targets.",5/5,https://scryfall.com/card/afc/115/bogardan-hellkite
459,6.0,Death Kiss,R,Creature,0.79,0.42,0.73,0.3,1.06,0.34,12571.0,0.8,{5}{R},"Whenever a creature an opponent controls attacks one of your opponents, double its power until end of turn.{X}{X}{R}: Monstrosity X.(If this creature isn’t monstrous, put X +1/+1 counters on it and it becomes monstrous.)When Death Kiss becomes monstrous, goad up to X target creatures your opponents control.",5/5,https://scryfall.com/card/clb/629/death-kiss
460,3.0,Aria of Flame,R,Enchantment,0.79,0.63,0.73,0.67,0.02,0.25,12484.0,0.8,{2}{R},"When Aria of Flame enters the battlefield, each opponent gains 10 life.Whenever you cast an instant or sorcery spell, put a verse counter on Aria of Flame, then it deals damage equal to the number of verse counters on it to target player or planeswalker.",,https://scryfall.com/card/mh1/118/aria-of-flame
461,1.0,Blazing Volley,C,Sorcery,0.35,0.08,0.11,0.09,0.03,0.05,12446.0,0.8,{R},Blazing Volley deals 1 damage to each creature your opponents control.,,https://scryfall.com/card/iko/107/blazing-volley
462,2.0,Fiendlash,U,Artifact,0.35,0.17,0.18,0.16,0.51,0.13,12425.0,0.8,{1}{R},"Equipped creature gets +2/+0 and has reach.Whenever equipped creature is dealt damage, it deals damage equal to its power to target player or planeswalker.Equip{2}{R}",,https://scryfall.com/card/cmm/221/fiendlash
463,4.0,Rose Room Treasurer,R,Creature,0.69,0.21,0.73,0.55,,0.18,12419.0,0.8,{3}{R},"Alliance— Whenever another creature enters the battlefield under your control, create a Treasure token if this is the first or second time this ability has resolved this turn. Otherwise, you may pay{X}. When you do, Rose Room Treasurer deals X damage to any target.",4/3,https://scryfall.com/card/ncc/51/rose-room-treasurer
464,3.0,Raid Bombardment,C,Enchantment,0.35,0.02,0.11,0.1,0.03,0.15,12407.0,0.8,{2}{R},"Whenever a creature you control with power 2 or less attacks, Raid Bombardment deals 1 damage to the player or planeswalker that creature is attacking.",,https://scryfall.com/card/wot/47/raid-bombardment
