,CMC,Name,Rarity,Type_x,Card Kingdom ($),TCGPlayer ($),Face to Face ($),Cardmarket (€),Cardhoarder (Event Ticket - TIX),Salt,Decks,Inclusion,Mana Cost,Text,Stats,URL
497,2.0,Wharf Infiltrator,R,Creature,0.69,0.17,0.55,0.23,0.02,0.18,14083.0,0.9,{1}{U},"Skulk(This creature can’t be blocked by creatures with greater power.)Whenever Wharf Infiltrator deals combat damage to a player, you may draw a card. If you do, discard a card.Whenever you discard a creature card, you may pay{2}. If you do, create a 3/2 colorless Eldrazi Horror creature token.",1/1,https://scryfall.com/card/sir/96/wharf-infiltrator
498,2.0,Winds of Rebuke,C,Instant,0.35,0.15,0.11,0.12,0.03,0.18,13965.0,0.8,{1}{U},Return target nonland permanent to its owner’s hand. Each player mills two cards.,,https://scryfall.com/card/akr/90/winds-of-rebuke
499,3.0,Chrome Host Seedshark,R,Creature,2.49,1.31,2.57,1.29,0.61,0.21,13955.0,0.8,{2}{U},"FlyingWhenever you cast a noncreature spell, incubate X, where X is that spell’s mana value.(Create an Incubator token with X +1/+1 counters on it and “{2}: Transform this artifact.” It transforms into a 0/0 Phyrexian artifact creature.)",2/4,https://scryfall.com/card/mom/51/chrome-host-seedshark
500,4.0,"Kasmina, Enigmatic Mentor",U,Planeswalker,0.35,0.17,0.18,0.08,0.03,0.27,13931.0,0.8,{3}{U},"Spells your opponents cast that target a creature or planeswalker you control cost{2}more to cast.−2: Create a 2/2 blue Wizard creature token. Draw a card, then discard a card.",Loyalty: 5,https://scryfall.com/card/j22/60/kasmina-enigmatic-mentor
501,8.0,Beacon of Tomorrows,R,Sorcery,4.49,2.73,4.42,1.47,0.02,1.22,13912.0,0.8,{6}{U}{U},Target player takes an extra turn after this one. Shuffle Beacon of Tomorrows into its owner’s library.,,https://scryfall.com/card/sld/1497/beacon-of-tomorrows
502,2.0,See the Truth,R,Sorcery,0.79,0.46,0.73,0.48,0.02,0.13,13910.0,0.8,{1}{U},"Look at the top three cards of your library. Put one of those cards into your hand and the rest on the bottom of your library in any order. If this spell was cast from anywhere other than your hand, put each of those cards into your hand instead.",,https://scryfall.com/card/m21/69/see-the-truth
503,2.0,Master of the Pearl Trident,R,Creature,1.49,0.74,1.47,0.9,0.1,0.83,13894.0,0.8,{U}{U},Other Merfolk creatures you control get +1/+1 and have islandwalk.(They can’t be blocked as long as defending player controls an Island.),2/2,https://scryfall.com/card/lcc/162/master-of-the-pearl-trident
504,3.0,Fraying Sanity,R,Enchantment,0.49,0.28,0.26,0.3,0.02,0.75,13834.0,0.8,{2}{U},"Enchant playerAt the beginning of each end step, enchanted player mills X cards, where X is the number of cards put into their graveyard from anywhere this turn.",,https://scryfall.com/card/wot/19/fraying-sanity
505,5.0,Gush,C,Instant,0.79,0.67,0.73,0.71,0.04,0.24,13750.0,0.8,{4}{U},You may return two Islands you control to their owner’s hand rather than pay this spell’s mana cost.Draw two cards.,,https://scryfall.com/card/pewk/1/gush
506,3.0,Merrow Reejerey,U,Creature,0.35,0.23,0.73,0.25,0.02,0.13,13729.0,0.8,{2}{U},"Other Merfolk creatures you control get +1/+1.Whenever you cast a Merfolk spell, you may tap or untap target permanent.",2/2,https://scryfall.com/card/lcc/165/merrow-reejerey
507,2.0,Familiar's Ruse,U,Instant,0.69,0.79,0.73,0.54,0.03,0.29,13682.0,0.8,{U}{U},"As an additional cost to cast this spell, return a creature you control to its owner’s hand.Counter target spell.",,https://scryfall.com/card/mm3/37/familiars-ruse
508,5.0,Submerge,U,Instant,5.99,4.89,6.26,2.11,5.55,0.25,13670.0,0.8,{4}{U},"If an opponent controls a Forest and you control an Island, you may cast this spell without paying its mana cost.Put target creature on top of its owner’s library.",,https://scryfall.com/card/wc00/tvdl48sb/submerge
509,1.0,Telepathy,U,Enchantment,0.49,0.23,0.26,0.14,0.03,1.04,13633.0,0.8,{U},Your opponents play with their hands revealed.,,https://scryfall.com/card/m10/74/telepathy
510,3.0,Hover Barrier,U,Creature,0.79,0.39,0.73,0.38,0.03,0.1,13615.0,0.8,{2}{U},"Defender, flying",0/6,https://scryfall.com/card/gk2/6/hover-barrier
511,5.0,Lórien Revealed,C,Sorcery,3.99,3.11,5.52,2.28,0.3,0.29,13594.0,0.8,{3}{U}{U},"Draw three cards.Islandcycling{1}({1}, Discard this card: Search your library for an Island card, reveal it, put it into your hand, then shuffle.)",,https://scryfall.com/card/ltr/60/l%C3%B3rien-revealed
512,2.0,Spellstutter Sprite,C,Creature,6.49,3.65,6.26,3.24,0.03,0.28,13581.0,0.8,{1}{U},"FlashFlyingWhen Spellstutter Sprite enters the battlefield, counter target spell with mana value X or less, where X is the number of Faeries you control.",1/1,https://scryfall.com/card/j22/65/spellstutter-sprite
513,2.0,Blink of an Eye,C,Instant,0.35,0.11,0.11,0.11,0.03,0.19,13470.0,0.8,{1}{U},"Kicker{1}{U}(You may pay an additional{1}{U}as you cast this spell.)Return target nonland permanent to its owner’s hand. If this spell was kicked, draw a card.",,https://scryfall.com/card/dom/46/blink-of-an-eye
514,2.0,Serum Snare,U,Instant,0.35,0.15,0.18,0.17,0.03,0.19,13407.0,0.8,{1}{U},"Return target nonland permanent to its owner’s hand. If that permanent had mana value 3 or less, proliferate.(Choose any number of permanents and/or players, then give each another counter of each kind already there.)",,https://scryfall.com/card/one/68/serum-snare
515,3.0,Merfolk Sovereign,R,Creature,0.49,0.25,0.55,0.23,0.02,0.07,13384.0,0.8,{1}{U}{U},Other Merfolk creatures you control get +1/+1.{T}: Target Merfolk creature can’t be blocked this turn.,2/2,https://scryfall.com/card/lcc/164/merfolk-sovereign
516,5.0,Illithid Harvester,R,Creature,0.69,0.28,,,,0.47,13361.0,0.8,{4}{U},"Ceremorphosis— When Illithid Harvester enters the battlefield, turn any number of target tapped nontoken creatures face down. They’re 2/2 Horror creatures.",4/4,https://scryfall.com/card/hbg/122/illithid-harvester-plant-tadpoles
517,3.0,Lapis Orb of Dragonkind,C,Artifact,0.35,0.11,0.11,0.13,,0.11,13335.0,0.8,{2}{U},"{T}: Add{U}. When you spend this mana to cast a Dragon creature spell, scry 2.(Look at the top two cards of your library, then put any number of them on the bottom of your library and the rest on top in any order.)",,https://scryfall.com/card/hbg/127/lapis-orb-of-dragonkind
518,5.0,"Higure, the Still Wind",R,Creature,8.99,6.99,9.58,2.53,0.02,0.4,13334.0,0.8,{3}{U}{U},"Ninjutsu{2}{U}{U}({2}{U}{U}, Return an unblocked attacker you control to hand: Put this card onto the battlefield from your hand tapped and attacking.)Whenever Higure, the Still Wind deals combat damage to a player, you may search your library for a Ninja card, reveal it, put it into your hand, then shuffle.{2}: Target Ninja creature can’t be blocked this turn.",3/4,https://scryfall.com/card/sld/1267/higure-the-still-wind
519,2.0,Mercurial Spelldancer,R,Creature,0.49,0.4,0.26,0.69,0.02,0.53,13328.0,0.8,{1}{U},"Mercurial Spelldancer can’t be blocked.Whenever you cast a noncreature spell, put an oil counter on Mercurial Spelldancer.Whenever Mercurial Spelldancer deals combat damage to a player, you may remove two oil counters from it. If you do, when you cast your next instant or sorcery spell this turn, copy that spell. You may choose new targets for the copy.",2/1,https://scryfall.com/card/one/61/mercurial-spelldancer
520,3.0,Grand Architect,R,Creature,0.79,0.82,0.73,0.4,0.02,0.31,13222.0,0.8,{1}{U}{U},Other blue creatures you control get +1/+1.{U}: Target artifact creature becomes blue until end of turn.Tap an untapped blue creature you control: Add{C}{C}. Spend this mana only to cast artifact spells or activate abilities of artifacts.,1/3,https://scryfall.com/card/2xm/53/grand-architect
521,5.0,Time Reversal,M,Sorcery,3.99,3.03,4.05,2.18,0.02,0.61,13141.0,0.8,{3}{U}{U},"Each player shuffles their hand and graveyard into their library, then draws seven cards. Exile Time Reversal.",,https://scryfall.com/card/sld/1499/time-reversal
522,5.0,"Jace, Unraveler of Secrets",M,Planeswalker,4.99,4.57,5.52,3.82,0.02,0.44,13136.0,0.8,{3}{U}{U},"+1: Scry 1, then draw a card.−2: Return target creature to its owner’s hand.−8: You get an emblem with “Whenever an opponent casts their first spell each turn, counter that spell.”",Loyalty: 5,https://scryfall.com/card/sir/77/jace-unraveler-of-secrets
523,2.0,Vision Skeins,C,Instant,0.59,0.33,0.36,0.11,0.03,0.03,13065.0,0.8,{1}{U},Each player draws two cards.,,https://scryfall.com/card/e01/29/vision-skeins
524,1.0,Peek,C,Instant,0.49,0.27,0.18,0.31,0.03,0.35,13039.0,0.8,{U},Look at target player’s hand.Draw a card.,,https://scryfall.com/card/sld/401/peek
525,2.0,Remand,U,Instant,1.79,1.0,1.84,1.32,0.03,0.28,13032.0,0.8,{1}{U},"Counter target spell. If that spell is countered this way, put it into its owner’s hand instead of into that player’s graveyard.Draw a card.",,https://scryfall.com/card/tsr/316/remand
526,4.0,Memory Deluge,R,Instant,0.69,0.36,0.73,0.9,0.1,0.22,13015.0,0.8,{2}{U}{U},"Look at the top X cards of your library, where X is the amount of mana spent to cast this spell. Put two of them into your hand and the rest on the bottom of your library in a random order.Flashback{5}{U}{U}(You may cast this card from your graveyard for its flashback cost. Then exile it.)",,https://scryfall.com/card/sch/8/memory-deluge
527,7.0,Curse of Unbinding,R,Enchantment,1.29,0.79,1.84,0.67,,0.72,12933.0,0.8,{6}{U},"Enchant playerAt the beginning of enchanted player’s upkeep, that player reveals cards from the top of their library until they reveal a creature card. Put that card onto the battlefield under your control. That player puts the rest of the revealed cards into their graveyard.",,https://scryfall.com/card/mic/12/curse-of-unbinding
528,12.0,Icebreaker Kraken,R,Creature,0.49,0.21,0.55,0.25,0.02,0.57,12929.0,0.8,{10}{U}{U},"This spell costs{1}less to cast for each snow land you control.When Icebreaker Kraken enters the battlefield, artifacts and creatures target opponent controls don’t untap during that player’s next untap step.Return three snow lands you control to their owner’s hand: Return Icebreaker Kraken to its owner’s hand.",8/8,https://scryfall.com/card/khm/63/icebreaker-kraken
529,3.0,Scion of Oona,R,Creature,1.99,1.23,2.94,1.5,0.02,0.7,12916.0,0.8,{2}{U},FlashFlyingOther Faerie creatures you control get +1/+1.Other Faeries you control have shroud.(They can’t be the targets of spells or abilities.),1/1,https://scryfall.com/card/woc/109/scion-of-oona
530,3.0,Champion of Wits,R,Creature,0.49,0.07,0.26,0.17,0.02,0.05,12913.0,0.8,{2}{U},"When Champion of Wits enters the battlefield, you may draw cards equal to its power. If you do, discard two cards.Eternalize{5}{U}{U}({5}{U}{U}, Exile this card from your graveyard: Create a token that’s a copy of it, except it’s a 4/4 black Zombie Naga Wizard with no mana cost. Eternalize only as a sorcery.)",2/1,https://scryfall.com/card/ncc/213/champion-of-wits
531,6.0,Spelltwine,R,Sorcery,0.49,0.24,0.26,0.27,0.02,0.46,12903.0,0.8,{5}{U},Exile target instant or sorcery card from your graveyard and target instant or sorcery card from an opponent’s graveyard. Copy those cards. Cast the copies if able without paying their mana costs. Exile Spelltwine.,,https://scryfall.com/card/c17/94/spelltwine
532,6.0,"Kairi, the Swirling Sky",M,Creature,0.99,0.63,0.73,0.9,0.01,0.23,12890.0,0.8,{4}{U}{U},"Flying, ward{3}When Kairi, the Swirling Sky dies, choose one —• Return any number of target nonland permanents with total mana value 6 or less to their owners’ hands.• Mill six cards, then return up to two instant and/or sorcery cards from your graveyard to your hand.",6/6,https://scryfall.com/card/neo/60/kairi-the-swirling-sky
533,3.0,"Jace, Mirror Mage",M,Planeswalker,0.99,0.35,0.73,0.36,0.06,0.21,12885.0,0.8,{1}{U}{U},"Kicker{2}When Jace, Mirror Mage enters the battlefield, if Jace was kicked, create a token that’s a copy of Jace, Mirror Mage, except it’s not legendary and its starting loyalty is 1.+1: Scry 2.0: Draw a card and reveal it. Remove a number of loyalty counters equal to that card’s mana value from Jace, Mirror Mage.",Loyalty: 4,https://scryfall.com/card/cmm/852/jace-mirror-mage
534,6.0,Inspiring Refrain,R,Sorcery,0.49,0.15,0.26,0.22,0.09,0.0,12873.0,0.8,{4}{U}{U},"Draw two cards. Exile Inspiring Refrain with three time counters on it.Suspend 3—{2}{U}(Rather than cast this card from your hand, you may pay{2}{U}and exile it with three time counters on it. At the beginning of your upkeep, remove a time counter. When the last is removed, cast it without paying its mana cost.)",,https://scryfall.com/card/who/216/inspiring-refrain
535,7.0,Windreader Sphinx,R,Creature,0.49,0.15,0.26,0.17,0.02,0.12,12842.0,0.8,{5}{U}{U},"FlyingWhenever a creature with flying attacks, you may draw a card.",3/7,https://scryfall.com/card/scd/64/windreader-sphinx
536,3.0,Deeproot Waters,U,Enchantment,0.35,0.17,0.18,0.13,0.02,0.08,12823.0,0.8,{2}{U},"Whenever you cast a Merfolk spell, create a 1/1 blue Merfolk creature token with hexproof.(A creature with hexproof can’t be the target of spells or abilities your opponents control.)",,https://scryfall.com/card/lcc/152/deeproot-waters
537,3.0,"Callaphe, Beloved of the Sea",U,Creature,0.35,0.1,0.18,0.09,0.03,0.21,12810.0,0.8,{1}{U}{U},Callaphe’s power is equal to your devotion to blue.(Each{U}in the mana costs of permanents you control counts toward your devotion to blue.)Creatures and enchantments you control have “Spells your opponents cast that target this permanent cost{1}more to cast.”,*/3,https://scryfall.com/card/plist/414/callaphe-beloved-of-the-sea
538,2.0,Watcher for Tomorrow,U,Creature,0.35,0.19,0.18,0.28,0.03,0.11,12789.0,0.8,{1}{U},"Hideaway 4(When this creature enters the battlefield, look at the top four cards of your library, exile one face down, then put the rest on the bottom in a random order.)Watcher for Tomorrow enters the battlefield tapped.When Watcher for Tomorrow leaves the battlefield, put the exiled card into its owner’s hand.",2/1,https://scryfall.com/card/mh1/76/watcher-for-tomorrow
539,4.0,Encroaching Mycosynth,R,Artifact,0.49,0.27,0.26,0.21,0.02,0.39,12771.0,0.8,{3}{U},Nonland permanents you control are artifacts in addition to their other types. The same is true for permanent spells you control and nonland permanent cards you own that aren’t on the battlefield.,,https://scryfall.com/card/one/47/encroaching-mycosynth
540,3.0,"Kopala, Warden of Waves",R,Creature,0.79,0.28,0.36,0.21,0.02,0.36,12765.0,0.8,{1}{U}{U},Spells your opponents cast that target a Merfolk you control cost{2}more to cast.Abilities your opponents activate that target a Merfolk you control cost{2}more to activate.,2/2,https://scryfall.com/card/lcc/160/kopala-warden-of-waves
541,3.0,Keep Watch,C,Instant,0.35,0.22,0.11,0.18,0.04,0.19,12719.0,0.8,{2}{U},Draw a card for each attacking creature.,,https://scryfall.com/card/woc/98/keep-watch
542,2.0,Thassa's Intervention,R,Instant,0.49,0.17,0.26,0.14,0.02,0.29,12692.0,0.8,{X}{U}{U},Choose one —• Look at the top X cards of your library. Put up to two of them into your hand and the rest on the bottom of your library in a random order.• Counter target spell unless its controller pays twice{X}.,,https://scryfall.com/card/thb/72/thassas-intervention
543,4.0,Undead Alchemist,R,Creature,0.69,0.29,0.73,0.27,0.02,0.33,12672.0,0.8,{3}{U},"If a Zombie you control would deal combat damage to a player, instead that player mills that many cards.Whenever a creature card is put into an opponent’s graveyard from their library, exile that card and create a 2/2 black Zombie creature token.",4/2,https://scryfall.com/card/mic/105/undead-alchemist
544,3.0,Thought Collapse,C,Instant,0.35,0.11,0.11,0.13,0.03,0.23,12655.0,0.8,{1}{U}{U},Counter target spell. Its controller mills three cards.,,https://scryfall.com/card/jmp/184/thought-collapse
545,2.0,Strategic Planning,C,Sorcery,0.35,0.01,0.11,0.04,0.03,0.17,12644.0,0.8,{1}{U},Look at the top three cards of your library. Put one of them into your hand and the rest into your graveyard.,,https://scryfall.com/card/sta/20/strategic-planning
546,4.0,Plea for Power,R,Sorcery,0.49,0.15,0.26,0.22,0.02,0.74,12603.0,0.8,{3}{U},"Will of the council— Starting with you, each player votes for time or knowledge. If time gets more votes, take an extra turn after this one. If knowledge gets more votes or the vote is tied, draw three cards.",,https://scryfall.com/card/ltc/195/plea-for-power
547,1.0,Shrieking Drake,C,Creature,0.69,0.3,0.55,0.43,0.04,0.45,12594.0,0.8,{U},"FlyingWhen Shrieking Drake enters the battlefield, return a creature you control to its owner’s hand.",1/1,https://scryfall.com/card/vis/43/shrieking-drake
548,2.0,"Esior, Wardwing Familiar",U,Creature,0.35,0.11,0.18,0.18,0.05,0.26,12580.0,0.8,{1}{U},FlyingSpells your opponents cast that target one or more commanders you control cost{3}more to cast.Partner(You can have two commanders if both have partner.),1/3,https://scryfall.com/card/cmr/67/esior-wardwing-familiar
549,3.0,Curator's Ward,U,Enchantment,0.39,0.3,0.55,0.14,0.03,0.25,12571.0,0.8,{2}{U},"Enchant permanentEnchanted permanent has hexproof.When enchanted permanent leaves the battlefield, if it was historic, draw two cards.(Artifacts, legendaries, and Sagas are historic.)",,https://scryfall.com/card/dom/49/curators-ward
550,4.0,Seafloor Oracle,R,Creature,0.49,0.12,0.55,0.21,0.04,0.18,12538.0,0.8,{2}{U}{U},"Whenever a Merfolk you control deals combat damage to a player, draw a card.",2/3,https://scryfall.com/card/lcc/170/seafloor-oracle
551,1.0,Icy Blast,R,Instant,1.29,0.81,1.1,0.33,0.02,0.44,12526.0,0.8,{X}{U},"Tap X target creatures.Ferocious— If you control a creature with power 4 or greater, those creatures don’t untap during their controllers’ next untap steps.",,https://scryfall.com/card/ktk/42/icy-blast
552,2.0,Telling Time,C,Instant,0.69,0.24,0.55,0.12,0.03,0.06,12470.0,0.8,{1}{U},"Look at the top three cards of your library. Put one of those cards into your hand, one on top of your library, and one on the bottom of your library.",,https://scryfall.com/card/gk1/4/telling-time
553,3.0,Whirlwind Denial,U,Instant,0.35,0.05,0.18,0.11,0.03,0.22,12459.0,0.8,{2}{U},"For each spell and ability your opponents control, counter it unless its controller pays{4}.",,https://scryfall.com/card/sta/23/whirlwind-denial
554,5.0,Souvenir Snatcher,R,Creature,0.79,0.53,0.73,0.22,3.06,0.31,12454.0,0.8,{4}{U},"Mutate{5}{U}(If you cast this spell for its mutate cost, put it over or under target non-Human creature you own. They mutate into the creature on top plus all abilities from under it.)FlyingWhenever this creature mutates, gain control of target noncreature artifact.",4/4,https://scryfall.com/card/c20/38/souvenir-snatcher
555,8.0,"Brinelin, the Moon Kraken",U,Creature,0.35,0.07,0.18,0.09,0.04,0.32,12390.0,0.8,{6}{U}{U},"When Brinelin, the Moon Kraken enters the battlefield or whenever you cast a spell with mana value 6 or greater, you may return target nonland permanent to its owner’s hand.Partner(You can have two commanders if both have partner.)",6/8,https://scryfall.com/card/cmm/78/brinelin-the-moon-kraken
556,2.0,Aphetto Alchemist,U,Creature,3.99,4.03,4.42,2.65,0.04,0.15,12385.0,0.8,{1}{U},{T}: Untap target artifact or creature.Morph{U}(You may cast this card face down as a 2/2 creature for{3}. Turn it face up any time for its morph cost.),1/2,https://scryfall.com/card/ons/64/aphetto-alchemist
557,1.0,Artful Dodge,C,Sorcery,0.49,0.24,0.36,0.43,0.03,0.36,12371.0,0.8,{U},Target creature can’t be blocked this turn.Flashback{U}(You may cast this card from your graveyard for its flashback cost. Then exile it.),,https://scryfall.com/card/dka/27/artful-dodge
558,6.0,Well of Ideas,R,Enchantment,0.69,0.95,0.55,0.36,0.11,0.17,12363.0,0.8,{5}{U},"When Well of Ideas enters the battlefield, draw two cards.At the beginning of each other player’s draw step, that player draws an additional card.At the beginning of your draw step, draw two additional cards.",,https://scryfall.com/card/2xm/75/well-of-ideas
559,4.0,Wash Out,U,Sorcery,0.49,0.3,0.73,0.14,0.04,0.99,12293.0,0.7,{3}{U},Return all permanents of the color of your choice to their owners’ hands.,,https://scryfall.com/card/2x2/67/wash-out
560,5.0,Virtue of Knowledge,M,Enchantment,6.99,5.37,,,0.11,0.12,12264.0,0.7,{4}{U},"If a permanent entering the battlefield causes a triggered ability of a permanent you control to trigger, that ability triggers an additional time.",,https://scryfall.com/card/woe/76/virtue-of-knowledge-vantress-visions
561,4.0,Insidious Will,R,Instant,0.49,0.48,0.26,0.32,0.02,0.31,12244.0,0.7,{2}{U}{U},Choose one —• Counter target spell.• You may choose new targets for target spell.• Copy target instant or sorcery spell. You may choose new targets for the copy.,,https://scryfall.com/card/kld/52/insidious-will
562,2.0,Hidden Strings,C,Sorcery,0.35,0.19,0.18,0.22,0.03,0.33,12227.0,0.7,{1}{U},"You may tap or untap target permanent, then you may tap or untap another target permanent.Cipher(Then you may exile this spell card encoded on a creature you control. Whenever that creature deals combat damage to a player, its controller may cast a copy of the encoded card without paying its mana cost.)",,https://scryfall.com/card/q06/5/hidden-strings
563,3.0,Copy Enchantment,R,Enchantment,0.49,0.53,0.55,0.48,0.02,0.26,12211.0,0.7,{2}{U},You may have Copy Enchantment enter the battlefield as a copy of any enchantment on the battlefield.,,https://scryfall.com/card/wot/16/copy-enchantment
564,3.0,Universal Surveillance,R,Sorcery,0.69,0.22,0.73,0.23,1.39,0.1,12209.0,0.7,{X}{U}{U}{U},Improvise(Your artifacts can help cast this spell. Each artifact you tap after you’re done activating mana abilities pays for{1}.)Draw X cards.,,https://scryfall.com/card/nec/17/universal-surveillance
565,2.0,Flood of Recollection,C,Sorcery,0.35,0.03,0.11,0.05,0.03,0.13,12183.0,0.7,{U}{U},Return target instant or sorcery card from your graveyard to your hand. Exile Flood of Recollection.,,https://scryfall.com/card/cmr/61/flood-of-recollection
566,3.0,Svyelun of Sea and Sky,M,Creature,0.99,0.62,1.1,0.49,2.0,0.4,12149.0,0.7,{1}{U}{U},"Svyelun of Sea and Sky has indestructible as long as you control at least two other Merfolk.Whenever Svyelun attacks, draw a card.Other Merfolk you control have ward{1}.(Whenever another Merfolk you control becomes the target of a spell or ability an opponent controls, counter it unless that player pays{1}.)",3/4,https://scryfall.com/card/lcc/175/svyelun-of-sea-and-sky
567,4.0,God-Eternal Kefnet,M,Creature,2.29,1.98,2.2,2.39,0.03,0.42,12104.0,0.7,{2}{U}{U},"FlyingYou may reveal the first card you draw each turn as you draw it. Whenever you reveal an instant or sorcery card this way, copy that card and you may cast the copy. That copy costs{2}less to cast.When God-Eternal Kefnet dies or is put into exile from the battlefield, you may put it into its owner’s library third from the top.",4/5,https://scryfall.com/card/ps19/53/god-eternal-kefnet
568,4.0,"Katsumasa, the Animator",R,Creature,0.49,0.2,0.26,0.21,0.62,0.17,12095.0,0.7,{2}{U}{U},"Flying{2}{U}: Until end of turn, target noncreature artifact you control becomes an artifact creature and gains flying. If it’s not a Vehicle, it has base power and toughness 1/1 until end of turn.At the beginning of your upkeep, put a +1/+1 counter on each of up to three target noncreature artifacts.",3/3,https://scryfall.com/card/nec/15/katsumasa-the-animator
569,2.0,Diplomatic Immunity,C,Enchantment,1.29,1.55,1.1,0.67,0.04,0.57,12055.0,0.7,{1}{U},Enchant creatureShroud(A permanent with shroud can’t be the target of spells or abilities.)Enchanted creature has shroud.,,https://scryfall.com/card/mmq/75/diplomatic-immunity
570,2.0,Twincast,R,Instant,2.99,3.56,3.68,2.02,0.02,0.41,12055.0,0.7,{U}{U},Copy target instant or sorcery spell. You may choose new targets for the copy.,,https://scryfall.com/card/m10/78/twincast
571,1.0,Artificer's Assistant,C,Creature,0.35,0.09,0.11,0.09,0.03,0.12,12050.0,0.7,{U},"FlyingWhenever you cast a historic spell, scry 1.(Artifacts, legendaries, and Sagas are historic. To scry 1, look at the top card of your library, then you may put that card on the bottom of your library.)",1/1,https://scryfall.com/card/mb1/291/artificers-assistant
572,5.0,Dazzling Sphinx,R,Creature,0.59,0.52,0.55,0.33,0.28,0.45,12037.0,0.7,{3}{U}{U},"FlyingWhenever Dazzling Sphinx deals combat damage to a player, that player exiles cards from the top of their library until they exile an instant or sorcery card. You may cast that card without paying its mana cost. Then that player puts the exiled cards that weren’t cast this way on the bottom of their library in a random order.",4/5,https://scryfall.com/card/c21/25/dazzling-sphinx
573,4.0,Sleep,U,Sorcery,0.35,0.16,0.18,0.08,0.03,0.9,11993.0,0.7,{2}{U}{U},Tap all creatures target player controls. Those creatures don’t untap during that player’s next untap step.,,https://scryfall.com/card/plist/465/sleep
574,2.0,Borne Upon a Wind,R,Instant,0.69,0.81,0.73,0.33,0.03,0.64,11985.0,0.7,{1}{U},You may cast spells this turn as though they had flash.Draw a card.,,https://scryfall.com/card/ltr/44/borne-upon-a-wind
575,2.0,Kasmina's Transmutation,C,Enchantment,0.35,0.02,0.11,0.06,0.03,0.68,11947.0,0.7,{1}{U},Enchant creatureEnchanted creature loses all abilities and has base power and toughness 1/1.,,https://scryfall.com/card/2x2/54/kasminas-transmutation
576,5.0,Stormsurge Kraken,R,Creature,0.69,0.44,0.55,0.65,0.5,0.44,11944.0,0.7,{3}{U}{U},"HexproofLieutenant— As long as you control your commander, Stormsurge Kraken gets +2/+2 and has “Whenever Stormsurge Kraken becomes blocked, you may draw two cards.”",5/5,https://scryfall.com/card/cmm/122/stormsurge-kraken
