,CMC,Name,Rarity,Type_x,Card Kingdom ($),TCGPlayer ($),Face to Face ($),Cardmarket (€),Cardhoarder (Event Ticket - TIX),Salt,Decks,Inclusion,Mana Cost,Text,Stats,URL
1263,3.0,Ulrich's Kindred,U,Creature,0.35,0.17,0.18,0.18,0.03,0.0,1302.0,0.2,{2}{R},Trample{3}{G}: Target attacking Wolf or Werewolf gains indestructible until end of turn.,3/2,https://scryfall.com/card/sir/182/ulrichs-kindred
1264,1.0,Akki War Paint,C,Enchantment,0.35,0.03,0.11,0.06,0.01,0.25,2896.0,0.2,{R},"Enchant artifact or creatureAs long as enchanted permanent is a creature, it gets +2/+1.",,https://scryfall.com/card/neo/132/akki-war-paint
1265,5.0,Rooting Moloch,U,Creature,0.35,0.01,0.18,0.07,0.03,0.0,2891.0,0.2,{4}{R},"When Rooting Moloch enters the battlefield, exile target card with a cycling ability from your graveyard. Until the end of your next turn, you may play that card.Cycling{2}({2}, Discard this card: Draw a card.)",4/4,https://scryfall.com/card/j22/590/rooting-moloch
1266,6.0,Gnoll War Band,U,Creature,0.35,0.1,0.18,0.1,,0.07,2887.0,0.2,{5}{R},"This spell costs{1}less to cast for each opponent who was dealt damage this turn.MenaceMyriad(Whenever this creature attacks, for each opponent other than defending player, you may create a token that’s a copy of this creature that’s tapped and attacking that player or a planeswalker they control. Exile the tokens at end of combat.)",5/5,https://scryfall.com/card/clb/178/gnoll-war-band
1267,2.0,Dangerous Wager,C,Instant,0.35,0.18,0.11,0.21,0.03,0.0,2883.0,0.2,{1}{R},"Discard your hand, then draw two cards.",,https://scryfall.com/card/avr/131/dangerous-wager
1268,3.0,Boiling Blood,C,Instant,0.35,0.13,0.11,0.12,0.04,0.0,2879.0,0.2,{2}{R},Target creature attacks this turn if able.Draw a card.,,https://scryfall.com/card/plist/610/boiling-blood
1269,3.0,Stone Rain,C,Sorcery,0.35,0.08,0.18,0.05,0.03,1.36,2878.0,0.2,{2}{R},Destroy target land.,,https://scryfall.com/card/30a/173/stone-rain
1270,3.0,Aisha of Sparks and Smoke,R,Creature,0.69,0.52,0.73,0.36,,0.0,1304.0,0.2,{1}{R}{R},"Prowess(Whenever you cast a noncreature spell, this creature gets +1/+1 until end of turn.){R/W}: Aisha of Sparks and Smoke gains first strike until end of turn.Whenever Aisha deals combat damage, you may cast a sorcery spell from your hand with mana value less than or equal to that damage without paying its mana cost.",4/2,https://scryfall.com/card/sld/430/aisha-of-sparks-and-smoke
1271,6.0,Explosion of Riches,U,Sorcery,0.35,0.01,0.18,0.08,0.04,0.14,2873.0,0.2,{5}{R},"Draw a card, then each other player may draw a card. Whenever a card is drawn this way, Explosion of Riches deals 5 damage to target opponent chosen at random from among your opponents.",,https://scryfall.com/card/scd/140/explosion-of-riches
1272,3.0,Soul Sear,U,Instant,0.35,0.09,0.18,0.05,0.03,0.13,2872.0,0.2,{2}{R},Soul Sear deals 5 damage to target creature or planeswalker. That permanent loses indestructible until end of turn.,,https://scryfall.com/card/m21/160/soul-sear
1273,5.0,Illicit Auction,R,Sorcery,1.79,1.91,1.84,1.27,0.03,0.65,2868.0,0.2,{3}{R}{R},"Each player may bid life for control of target creature. You start the bidding with a bid of 0. In turn order, each player may top the high bid. The bidding ends if the high bid stands. The high bidder loses life equal to the high bid and gains control of the creature.(This effect lasts indefinitely.)",,https://scryfall.com/card/6ed/190/illicit-auction
1274,2.0,Firecat Blitz,U,Sorcery,0.35,0.39,0.26,0.43,0.04,0.17,2864.0,0.2,{X}{R}{R},"Create X 1/1 red Elemental Cat creature tokens with haste. Exile them at the beginning of the next end step.Flashback—{R}{R}, Sacrifice X Mountains.(You may cast this card from your graveyard for its flashback cost. Then exile it.)",,https://scryfall.com/card/jud/88/firecat-blitz
1275,4.0,Seeker of Slaanesh,U,Creature,0.35,0.1,0.18,0.17,,0.15,2856.0,0.2,{3}{R},HasteAllure of Slaanesh— Each opponent must attack with at least one creature each combat if able.,3/3,https://scryfall.com/card/40k/85/seeker-of-slaanesh
1276,1.0,Vexing Devil,R,Creature,2.99,2.17,2.94,3.48,0.03,0.29,2855.0,0.2,{R},"When Vexing Devil enters the battlefield, any opponent may have it deal 4 damage to them. If a player does, sacrifice Vexing Devil.",4/3,https://scryfall.com/card/uma/154/vexing-devil
1277,6.0,Sun-Crowned Hunters,C,Creature,0.35,0.1,0.11,0.13,0.03,0.0,2849.0,0.2,{4}{R}{R},"Enrage— Whenever Sun-Crowned Hunters is dealt damage, it deals 3 damage to target opponent or planeswalker.",5/4,https://scryfall.com/card/mb1/1074/sun-crowned-hunters
1278,1.0,Sudden Demise,R,Sorcery,0.49,0.2,0.26,0.17,0.03,0.4,2844.0,0.2,{X}{R},Choose a color. Sudden Demise deals X damage to each creature of the chosen color.,,https://scryfall.com/card/mb1/1071/sudden-demise
1279,3.0,Seismic Strike,C,Instant,0.35,0.12,0.18,0.05,0.03,0.56,2840.0,0.2,{2}{R},Seismic Strike deals damage to target creature equal to the number of Mountains you control.,,https://scryfall.com/card/m15/280/seismic-strike
1280,5.0,Charging Monstrosaur,U,Creature,0.35,0.13,0.18,0.1,0.03,0.0,2838.0,0.2,{4}{R},"Trample, haste",5/5,https://scryfall.com/card/mb1/886/charging-monstrosaur
1281,1.0,Frenzied Goblin,C,Creature,0.35,0.11,0.11,0.05,0.03,0.08,2837.0,0.2,{R},"Whenever Frenzied Goblin attacks, you may pay{R}. If you do, target creature can’t block this turn.",1/1,https://scryfall.com/card/j22/536/frenzied-goblin
1282,3.0,Voldaren Thrillseeker,R,Creature,1.29,0.36,0.73,0.3,0.13,0.1,2837.0,0.2,{2}{R},"Backup 2(When this creature enters the battlefield, put two +1/+1 counters on target creature. If that’s another creature, it gains the following ability until end of turn.){1}, Sacrifice this creature: It deals damage equal to its power to any target.",1/1,https://scryfall.com/card/mom/171/voldaren-thrillseeker
1283,3.0,Giant Cindermaw,U,Creature,0.35,0.11,0.18,0.12,0.03,0.39,2835.0,0.2,{2}{R},TramplePlayers can’t gain life.,4/3,https://scryfall.com/card/bro/136/giant-cindermaw
1284,5.0,The Shattered States Era,C,Enchantment,0.35,0.02,,,0.01,0.06,2827.0,0.2,{4}{R},"(As this Saga enters and after your draw step, add a lore counter.)I — Gain control of target creature until end of turn. Untap it. It gains haste until end of turn.II — Creatures you control get +1/+0 until end of turn.III — Exile this Saga, then return it to the battlefield transformed under your control.",3/3,https://scryfall.com/card/neo/162/the-shattered-states-era-nameless-conqueror
1285,4.0,Fangblade Brigand,U,Creature,0.35,0.04,,,0.03,0.08,2823.0,0.2,{3}{R},"{1}{R}: Fangblade Brigand gets +1/+0 and gains first strike until end of turn.Daybound(If a player casts no spells during their own turn, it becomes night next turn.)",3/4,https://scryfall.com/card/dbl/139/fangblade-brigand-fangblade-eviscerator
1286,1.0,Lava Spike,U,Sorcery,1.29,1.69,1.47,1.44,0.18,0.0,2821.0,0.2,{R},Lava Spike deals 3 damage to target player or planeswalker.,,https://scryfall.com/card/tsr/347/lava-spike
1287,3.0,Reckless Bushwhacker,U,Creature,1.79,0.7,1.84,1.51,0.39,0.33,2814.0,0.2,{2}{R},"Surge{1}{R}(You may cast this spell for its surge cost if you or a teammate has cast another spell this turn.)HasteWhen Reckless Bushwhacker enters the battlefield, if its surge cost was paid, other creatures you control get +1/+0 and gain haste until end of turn.",2/1,https://scryfall.com/card/ogw/116/reckless-bushwhacker
1288,1.0,Desperate Gambit,U,Instant,0.99,0.58,0.73,0.38,0.04,0.14,2814.0,0.2,{R},"Choose a source you control and flip a coin. If you win the flip, the next time that source would deal damage this turn, it deals double that damage instead. If you lose the flip, the next time it would deal damage this turn, prevent that damage.",,https://scryfall.com/card/wth/96/desperate-gambit
1289,2.0,Incinerate,C,Instant,0.35,0.05,0.11,0.02,0.03,0.18,2814.0,0.2,{1}{R},Incinerate deals 3 damage to any target. A creature dealt damage this way can’t be regenerated this turn.,,https://scryfall.com/card/jvc/51/incinerate
1290,2.0,Invasion of Mercadia,U,Battle,0.35,0.07,,,0.03,0.07,2812.0,0.2,{1}{R},"(As a Siege enters, choose an opponent to protect it. You and others can attack it. When it’s defeated, exile it, then cast it transformed.)When Invasion of Mercadia enters the battlefield, you may discard a card. If you do, draw two cards.",Defense: 4,https://scryfall.com/card/mom/147/invasion-of-mercadia-kyren-flamewright
1291,2.0,Abbot of Keral Keep,R,Creature,0.49,0.21,0.26,0.25,0.02,0.0,2811.0,0.2,{1}{R},"Prowess(Whenever you cast a noncreature spell, this creature gets +1/+1 until end of turn.)When Abbot of Keral Keep enters the battlefield, exile the top card of your library. Until end of turn, you may play that card.",2/1,https://scryfall.com/card/ea3/2/abbot-of-keral-keep
1292,4.0,Two-Headed Giant,R,Creature,0.49,0.12,0.26,0.11,0.02,0.25,2802.0,0.2,{2}{R}{R},"Whenever Two-Headed Giant attacks, flip two coins. If both coins come up heads, Two-Headed Giant gains double strike until end of turn. If both coins come up tails, Two-Headed Giant gains menace until end of turn.",4/4,https://scryfall.com/card/mb1/1086/two-headed-giant
1293,2.0,Primitive Justice,U,Sorcery,0.35,0.23,0.18,0.33,0.06,0.0,1253.0,0.2,{1}{R},"As an additional cost to cast this spell, you may pay{1}{R}and/or{1}{G}any number of times.Destroy target artifact. For each additional{1}{R}you paid, destroy another target artifact. For each additional{1}{G}you paid, destroy another target artifact, and you gain 1 life.",,https://scryfall.com/card/me4/130/primitive-justice
1294,2.0,Rimrock Knight,C,Creature,0.35,0.03,,,0.03,0.0,2792.0,0.2,{1}{R},Rimrock Knight can’t block.,3/1,https://scryfall.com/card/eld/137/rimrock-knight-boulder-rush
1295,7.0,Siege Dragon,R,Creature,0.49,0.34,0.26,0.23,0.02,0.0,2784.0,0.2,{5}{R}{R},"FlyingWhen Siege Dragon enters the battlefield, destroy all Walls your opponents control.Whenever Siege Dragon attacks, if defending player controls no Walls, it deals 2 damage to each creature without flying that player controls.",5/5,https://scryfall.com/card/anb/85/siege-dragon
1296,3.0,Prophetic Flamespeaker,M,Creature,0.99,0.38,0.73,0.86,0.02,0.29,2783.0,0.2,{1}{R}{R},"Double strike, trampleWhenever Prophetic Flamespeaker deals combat damage to a player, exile the top card of your library. You may play it this turn.",1/3,https://scryfall.com/card/jou/106/prophetic-flamespeaker
1297,6.0,The Parting of the Ways,R,Enchantment,0.49,0.2,0.26,0.34,,0.0,2780.0,0.2,{4}{R}{R},"(As this Saga enters and after your draw step, add a lore counter. Sacrifice after III.)I — Exile the top five cards of your library. For each nonland card exiled this way, put a number of time counters on that card equal to its mana value. If it doesn’t have suspend, it gains suspend.II — Time travel, then time travel.III — For each opponent, destroy up to one target artifact that player controls.",,https://scryfall.com/card/who/91/the-parting-of-the-ways
1298,1.0,Mark of Fury,C,Enchantment,0.35,0.2,0.11,0.19,0.04,0.75,2775.0,0.2,{R},"Enchant creatureEnchanted creature has haste.At the beginning of the end step, return Mark of Fury to its owner’s hand.",,https://scryfall.com/card/uds/93/mark-of-fury
1299,6.0,Capricious Hellraiser,M,Creature,0.99,0.29,0.73,0.04,0.09,0.15,2772.0,0.2,{3}{R}{R}{R},"This spell costs{3}less to cast if you have nine or more cards in your graveyard.FlyingWhen Capricious Hellraiser enters the battlefield, exile three cards at random from your graveyard. Choose a noncreature, nonland card from among them and copy it. You may cast the copy without paying its mana cost.",4/4,https://scryfall.com/card/one/125/capricious-hellraiser
1300,6.0,Spitebellows,C,Creature,0.35,0.04,0.11,0.04,0.03,0.18,2771.0,0.2,{5}{R},"When Spitebellows leaves the battlefield, it deals 6 damage to target creature.Evoke{1}{R}{R}(You may cast this spell for its evoke cost. If you do, it’s sacrificed when it enters the battlefield.)",6/1,https://scryfall.com/card/cmm/257/spitebellows
1301,4.0,Mad Ratter,U,Creature,0.35,0.06,0.18,0.04,0.03,0.33,2771.0,0.2,{3}{R},"Whenever you draw your second card each turn, create two 1/1 black Rat creature tokens.",1/2,https://scryfall.com/card/j22/570/mad-ratter
1302,1.0,Ground Rift,C,Sorcery,0.35,0.18,0.11,0.54,0.03,0.25,2765.0,0.2,{R},"Target creature without flying can’t block this turn.Storm(When you cast this spell, copy it for each spell cast before it this turn. You may choose new targets for the copies.)",,https://scryfall.com/card/tsp/162/ground-rift
1303,2.0,Custody Battle,U,Enchantment,0.49,0.47,0.73,0.2,0.04,0.42,2757.0,0.2,{1}{R},"Enchant creatureEnchanted creature has “At the beginning of your upkeep, target opponent gains control of this creature unless you sacrifice a land.”",,https://scryfall.com/card/ons/197/custody-battle
1304,5.0,Fiery Encore,R,Sorcery,0.49,0.1,0.26,0.13,0.26,0.38,2753.0,0.2,{4}{R},"Discard a card, then draw a card. When you discard a nonland card this way, Fiery Encore deals damage equal to that card’s mana value to target creature or planeswalker.Storm(When you cast this spell, copy it for each spell cast before it this turn.)",,https://scryfall.com/card/c21/51/fiery-encore
1305,1.0,Barrage of Expendables,U,Enchantment,0.35,0.08,0.18,0.14,0.03,0.38,2748.0,0.2,{R},"{R}, Sacrifice a creature: Barrage of Expendables deals 1 damage to any target.",,https://scryfall.com/card/jmp/292/barrage-of-expendables
1306,5.0,Spreading Insurrection,U,Sorcery,0.35,0.04,0.18,0.06,0.03,0.64,2743.0,0.2,{4}{R},"Gain control of target creature you don’t control until end of turn. Untap that creature. It gains haste until end of turn.Storm(When you cast this spell, copy it for each spell cast before it this turn. You may choose new targets for the copies.)",,https://scryfall.com/card/j21/518/spreading-insurrection
1307,2.0,Crush Underfoot,C,Instant,0.35,0.21,0.11,0.23,0.03,0.36,2731.0,0.2,{1}{R},Choose a Giant creature you control. It deals damage equal to its power to target creature.,,https://scryfall.com/card/mma/109/crush-underfoot
1308,1.0,Panic,C,Instant,0.35,0.17,0.11,0.15,0.04,0.0,2726.0,0.2,{R},Cast this spell only during combat before blockers are declared.Target creature can’t block this turn.Draw a card at the beginning of the next turn’s upkeep.,,https://scryfall.com/card/me2/145/panic
1309,7.0,Hit the Mother Lode,R,Sorcery,0.49,0.23,0.36,0.18,0.01,0.0,2718.0,0.2,{4}{R}{R}{R},"Discover 10. If the discovered card’s mana value is less than 10, create a number of tapped Treasure tokens equal to the difference.(To discover 10, exile cards from the top of your library until you exile a nonland card with mana value 10 or less. Cast it without paying its mana cost or put it into your hand. Put the rest on the bottom in a random order.)",,https://scryfall.com/card/lci/153/hit-the-mother-lode
1310,2.0,Distemper of the Blood,C,Sorcery,0.35,0.09,0.11,0.09,0.03,0.0,2711.0,0.2,{1}{R},"Target creature gets +2/+2 and gains trample until end of turn.Madness{R}(If you discard this card, discard it into exile. When you do, cast it for its madness cost or put it into your graveyard.)",,https://scryfall.com/card/mb1/906/distemper-of-the-blood
1311,3.0,Seismic Assault,R,Enchantment,0.49,0.28,0.26,0.39,0.02,0.33,2704.0,0.2,{R}{R}{R},Discard a land card: Seismic Assault deals 2 damage to any target.,,https://scryfall.com/card/uma/146/seismic-assault
1312,2.0,Chandra's Pyrohelix,C,Instant,0.35,0.04,0.11,0.04,0.03,0.0,2698.0,0.2,{1}{R},Chandra’s Pyrohelix deals 2 damage divided as you choose among one or two targets.,,https://scryfall.com/card/j22/514/chandras-pyrohelix
1313,2.0,Chandra's Embercat,C,Creature,0.35,0.08,0.11,0.05,0.03,0.0,2690.0,0.2,{1}{R},{T}: Add{R}. Spend this mana only to cast an Elemental spell or a Chandra planeswalker spell.,2/2,https://scryfall.com/card/m20/129/chandras-embercat
1314,1.0,Goblin Guide,R,Creature,1.49,2.67,3.68,2.17,0.72,0.11,2686.0,0.2,{R},"HasteWhenever Goblin Guide attacks, defending player reveals the top card of their library. If it’s a land card, that player puts it into their hand.",2/2,https://scryfall.com/card/plg21/4/goblin-guide
1315,2.0,Picnic Ruiner,U,Creature,0.35,0.05,,,0.02,0.1,1203.0,0.2,{1}{R},"Whenever Picnic Ruiner attacks while you control a creature with power 4 or greater, Picnic Ruiner gains double strike until end of turn.",2/2,https://scryfall.com/card/woe/232/picnic-ruiner-stolen-goodies
1316,2.0,Insufferable Balladeer,C,Creature,0.35,0.05,0.11,0.08,,0.27,2673.0,0.2,{1}{R},"Vicious Mockery— When Insufferable Balladeer enters the battlefield, target creature an opponent controls can’t block this turn. Goad it.(Until your next turn, that creature attacks each combat if able and attacks a player other than you if able.)",2/1,https://scryfall.com/card/clb/184/insufferable-balladeer
1317,3.0,Threaten,U,Sorcery,0.49,0.25,0.55,0.11,0.03,0.22,2670.0,0.2,{2}{R},Untap target creature and gain control of it until end of turn. That creature gains haste until end of turn.(It can attack and{T}this turn.),,https://scryfall.com/card/10e/242/threaten
1318,5.0,Falkenrath Celebrants,C,Creature,0.35,0.02,0.11,0.09,0.03,0.13,2667.0,0.2,{4}{R},"Menace(This creature can’t be blocked except by two or more creatures.)When Falkenrath Celebrants enters the battlefield, create two Blood tokens.(They’re artifacts with “{1},{T}, Discard a card, Sacrifice this artifact: Draw a card.”)",4/4,https://scryfall.com/card/dbl/423/falkenrath-celebrants
1319,1.0,Tin Street Dodger,U,Creature,0.35,0.11,0.18,0.15,0.03,0.22,2663.0,0.2,{R},Haste{R}: Tin Street Dodger can’t be blocked this turn except by creatures with defender.,1/1,https://scryfall.com/card/rna/120/tin-street-dodger
1320,3.0,Granite Grip,C,Enchantment,0.35,0.15,0.11,0.12,0.06,0.22,2649.0,0.2,{2}{R},Enchant creatureEnchanted creature gets +1/+0 for each Mountain you control.,,https://scryfall.com/card/ulg/81/granite-grip
1321,5.0,Soulgorger Orgg,U,Creature,0.35,0.22,0.26,0.51,0.05,0.2,2648.0,0.2,{3}{R}{R},"TrampleWhen Soulgorger Orgg enters the battlefield, you lose all but 1 life.When Soulgorger Orgg leaves the battlefield, you gain life equal to the life you lost when it entered the battlefield.",6/6,https://scryfall.com/card/jud/99/soulgorger-orgg
1322,4.0,Start Your Engines,U,Sorcery,0.35,0.05,0.18,0.14,0.03,0.0,2648.0,0.2,{3}{R},Vehicles you control become artifact creatures until end of turn. Creatures you control get +2/+0 until end of turn.,,https://scryfall.com/card/kld/135/start-your-engines
1323,2.0,Fanning the Flames,U,Sorcery,0.39,0.42,0.26,0.17,0.02,0.2,2642.0,0.2,{X}{R}{R},"Buyback{3}(You may pay an additional{3}as you cast this spell. If you do, put this card into your hand as it resolves.)Fanning the Flames deals X damage to any target.",,https://scryfall.com/card/tpr/130/fanning-the-flames
1324,4.0,Ravenous Baboons,R,Creature,3.49,3.99,4.05,1.98,0.05,1.17,2637.0,0.2,{3}{R},"When Ravenous Baboons enters the battlefield, destroy target nonbasic land.",2/2,https://scryfall.com/card/exo/97/ravenous-baboons
1325,1.0,Mutiny,C,Sorcery,0.35,0.05,0.11,0.08,0.03,0.13,2634.0,0.2,{R},Target creature an opponent controls deals damage equal to its power to another target creature that player controls.,,https://scryfall.com/card/mb1/1018/mutiny
1326,6.0,Khorvath Brightflame,R,Creature,0.49,0.49,0.26,0.68,0.09,0.25,2634.0,0.2,{5}{R},"Partner with Sylvia Brightspear(When this creature enters the battlefield, target player may put Sylvia into their hand from their library, then shuffle.)Flying, hasteKnights your team controls have flying and haste.",3/4,https://scryfall.com/card/bbd/9/khorvath-brightflame
1327,1.0,Goblin Javelineer,C,Creature,0.35,0.04,0.11,0.11,0.03,0.0,2625.0,0.2,{R},"HasteWhenever Goblin Javelineer becomes blocked, it deals 1 damage to target creature blocking it.",1/1,https://scryfall.com/card/afr/144/goblin-javelineer
1328,3.0,Shackles of Treachery,C,Sorcery,0.35,0.05,0.11,0.07,0.03,0.0,2621.0,0.2,{2}{R},"Gain control of target creature until end of turn. Untap that creature. Until end of turn, it gains haste and “Whenever this creature deals damage, destroy target Equipment attached to it.”",,https://scryfall.com/card/khm/150/shackles-of-treachery
1329,1.0,Grim Initiate,C,Creature,0.35,0.05,0.11,0.07,0.03,0.11,2619.0,0.2,{R},"First strikeWhen Grim Initiate dies, amass Zombies 1.(Put a +1/+1 counter on an Army you control. It’s also a Zombie. If you don’t control an Army, create a 0/0 black Zombie Army creature token first.)",1/1,https://scryfall.com/card/war/130/grim-initiate
1330,3.0,Sensation Gorger,R,Creature,2.99,3.17,2.94,1.51,0.02,0.69,2617.0,0.2,{1}{R}{R},"Kinship— At the beginning of your upkeep, you may look at the top card of your library. If it shares a creature type with Sensation Gorger, you may reveal it. If you do, each player discards their hand, then draws four cards.",2/2,https://scryfall.com/card/mor/102/sensation-gorger
1331,7.0,Collision of Realms,R,Sorcery,0.49,0.11,0.26,0.18,0.26,0.93,2605.0,0.2,{6}{R},"Each player shuffles all creatures they own into their library. Each player who shuffled a nontoken creature into their library this way reveals cards from the top of their library until they reveal a creature card, then puts that card onto the battlefield and the rest on the bottom of their library in a random order.",,https://scryfall.com/card/nec/19/collision-of-realms
1332,6.0,Tide of War,R,Enchantment,2.29,1.17,2.2,0.52,0.02,0.63,2603.0,0.2,{4}{R}{R},"Whenever one or more creatures block, flip a coin. If you win the flip, each blocking creature is sacrificed by its controller. If you lose the flip, each blocked creature is sacrificed by its controller.",,https://scryfall.com/card/chk/194/tide-of-war
1333,7.0,Goblin Game,R,Sorcery,0.49,0.53,0.26,0.15,0.02,1.23,2598.0,0.2,{5}{R}{R},"Each player hides at least one item, then all players reveal them simultaneously. Each player loses life equal to the number of items they revealed. The player who revealed the fewest items then loses half their life, rounded up. If two or more players are tied for fewest, each loses half their life, rounded up.",,https://scryfall.com/card/mb1/954/goblin-game
1334,4.0,Wildfire Eternal,R,Creature,0.49,0.25,0.26,0.19,0.02,0.14,2597.0,0.2,{3}{R},"Afflict 4(Whenever this creature becomes blocked, defending player loses 4 life.)Whenever Wildfire Eternal attacks and isn’t blocked, you may cast an instant or sorcery spell from your hand without paying its mana cost.",1/4,https://scryfall.com/card/hou/109/wildfire-eternal
1335,2.0,Delete,R,Sorcery,0.99,0.41,0.73,0.54,,0.0,2596.0,0.2,{X}{R}{R},Delete deals X damage to each nonartifact creature and each player.,,https://scryfall.com/card/who/81/delete
1336,2.0,Dragon Breath,U,Enchantment,0.35,0.16,0.11,0.11,0.04,0.14,2587.0,0.2,{1}{R},"Enchant creatureEnchanted creature has haste.{R}: Enchanted creature gets +1/+0 until end of turn.When a creature with mana value 6 or greater enters the battlefield, you may return Dragon Breath from your graveyard to the battlefield attached to that creature.",,https://scryfall.com/card/mb1/907/dragon-breath
1337,1.0,Searing Touch,U,Instant,0.39,0.3,0.26,0.23,0.04,0.17,2579.0,0.2,{R},"Buyback{4}(You may pay an additional{4}as you cast this spell. If you do, put this card into your hand as it resolves.)Searing Touch deals 1 damage to any target.",,https://scryfall.com/card/tpr/155/searing-touch
1338,3.0,Act on Impulse,U,Sorcery,0.35,0.14,0.18,0.1,0.03,0.11,2579.0,0.2,{2}{R},"Exile the top three cards of your library. Until end of turn, you may play cards exiled this way.(If you cast a spell this way, you still pay its costs. You can play a land this way only if you have an available land play remaining.)",,https://scryfall.com/card/j22/492/act-on-impulse
1339,2.0,Deathbellow Raider,C,Creature,0.35,0.04,0.11,0.1,0.03,0.0,1237.0,0.2,{1}{R},Deathbellow Raider attacks each combat if able.{2}{B}: Regenerate Deathbellow Raider.,2/3,https://scryfall.com/card/ths/117/deathbellow-raider
1340,2.0,Boiling Earth,C,Sorcery,0.35,0.07,0.11,0.08,0.03,0.27,2567.0,0.2,{1}{R},"Boiling Earth deals 1 damage to each creature your opponents control.Awaken 4—{6}{R}(If you cast this spell for{6}{R}, also put four +1/+1 counters on target land you control and it becomes a 0/0 Elemental creature with haste. It’s still a land.)",,https://scryfall.com/card/mb1/866/boiling-earth
1341,5.0,Fortune Thief,R,Creature,0.49,0.27,0.55,0.15,0.02,0.18,2562.0,0.2,{4}{R},Damage that would reduce your life total to less than 1 reduces it to 1 instead.Morph{R}{R}(You may cast this card face down as a 2/2 creature for{3}. Turn it face up any time for its morph cost.),0/1,https://scryfall.com/card/a25/130/fortune-thief
1342,5.0,Giant Harbinger,U,Creature,0.35,0.32,0.26,0.2,0.03,0.0,2559.0,0.2,{4}{R},"When Giant Harbinger enters the battlefield, you may search your library for a Giant card, reveal it, then shuffle and put that card on top.",3/4,https://scryfall.com/card/lrw/169/giant-harbinger
1343,2.0,Kargan Intimidator,R,Creature,0.49,0.05,0.26,0.1,0.02,0.0,2558.0,0.2,{1}{R},Cowards can’t block Warriors.{1}: Choose one that hasn’t been chosen this turn —• Kargan Intimidator gets +1/+1 until end of turn.• Target creature becomes a Coward until end of turn.• Target Warrior gains trample until end of turn.,3/1,https://scryfall.com/card/znr/145/kargan-intimidator
1344,3.0,Aether Membrane,U,Creature,0.49,0.3,0.55,0.43,0.03,0.33,2546.0,0.2,{1}{R}{R},"Defender; reach(This creature can block creatures with flying.)Whenever Aether Membrane blocks a creature, return that creature to its owner’s hand at end of combat.",0/5,https://scryfall.com/card/ddi/48/aether-membrane
