,CMC,Name,Rarity,Type_x,Card Kingdom ($),TCGPlayer ($),Face to Face ($),Cardmarket (€),Cardhoarder (Event Ticket - TIX),Salt,Decks,Inclusion,Mana Cost,Text,Stats,URL
490,2.0,Slaughter Specialist,R,Creature,0.69,0.27,0.55,0.3,0.02,0.1,13762.0,0.8,{1}{B},"When Slaughter Specialist enters the battlefield, each opponent creates a 1/1 white Human creature token.Whenever a creature an opponent controls dies, put a +1/+1 counter on Slaughter Specialist.",3/3,https://scryfall.com/card/dbl/122/slaughter-specialist
491,2.0,Smallpox,U,Sorcery,0.39,0.2,0.26,0.17,0.03,1.05,13687.0,0.8,{B}{B},"Each player loses 1 life, discards a card, sacrifices a creature, then sacrifices a land.",,https://scryfall.com/card/tsr/139/smallpox
492,7.0,"Arvinox, the Mind Flail",M,Creature,2.29,3.13,1.84,0.71,,0.58,13666.0,0.8,{4}{B}{B}{B},"Arvinox, the Mind Flail isn’t a creature unless you control three or more permanents you don’t own.At the beginning of your end step, exile the bottom card of each opponent’s library face down. For as long as those cards remain exiled, you may look at them, you may cast permanent spells from among them, and you may spend mana as though it were mana of any color to cast those spells.",9/9,https://scryfall.com/card/sld/340/arvinox-the-mind-flail
493,3.0,Loyal Subordinate,U,Creature,0.35,0.19,0.18,0.18,0.04,0.11,13652.0,0.8,{2}{B},"MenaceLieutenant— At the beginning of combat on your turn, if you control your commander, each opponent loses 3 life.",3/1,https://scryfall.com/card/cmm/172/loyal-subordinate
494,3.0,"Ayara, Widow of the Realm",R,Creature,0.49,0.23,,,0.02,0.14,6084.0,0.8,{1}{B}{B},"{T}, Sacrifice another creature or artifact: Ayara, Widow of the Realm deals X damage to target opponent or battle and you gain X life, where X is the sacrificed permanent’s mana value.{5}{R/P}: Transform Ayara. Activate only as a sorcery.({R/P}can be paid with either{R}or 2 life.)",3/3,https://scryfall.com/card/mom/90/ayara-widow-of-the-realm-ayara-furnace-queen
495,1.0,Dark Salvation,R,Sorcery,0.49,0.26,0.26,0.29,0.02,0.14,13606.0,0.8,{X}{X}{B},"Target player creates X 2/2 black Zombie creature tokens, then up to one target creature gets -1/-1 until end of turn for each Zombie that player controls.",,https://scryfall.com/card/sir/105/dark-salvation
496,5.0,Guiltfeeder,R,Creature,0.69,0.3,0.55,0.19,0.27,0.24,13554.0,0.8,{3}{B}{B},"Fear(This creature can’t be blocked except by artifact creatures and/or black creatures.)Whenever Guiltfeeder attacks and isn’t blocked, defending player loses 1 life for each card in their graveyard.",0/4,https://scryfall.com/card/clb/756/guiltfeeder
497,6.0,"Geth, Lord of the Vault",M,Creature,0.99,0.26,0.73,0.38,0.02,0.39,13541.0,0.8,{4}{B}{B},Intimidate(This creature can’t be blocked except by artifact creatures and/or creatures that share a color with it.){X}{B}: Put target artifact or creature card with mana value X from an opponent’s graveyard onto the battlefield under your control tapped. Then that player mills X cards.,5/5,https://scryfall.com/card/brc/107/geth-lord-of-the-vault
498,3.0,Hellish Rebuke,R,Instant,1.49,0.85,0.73,0.99,,0.34,13525.0,0.8,{2}{B},"Until end of turn, permanents your opponents control gain “When this permanent deals damage to the player who cast Hellish Rebuke, sacrifice this permanent. You lose 2 life.”",,https://scryfall.com/card/afc/26/hellish-rebuke
499,3.0,Bottomless Pit,U,Enchantment,1.79,1.31,2.2,1.55,0.12,1.28,13514.0,0.8,{1}{B}{B},"At the beginning of each player’s upkeep, that player discards a card at random.",,https://scryfall.com/card/sld/1404/bottomless-pit
500,6.0,Dreadhound,U,Creature,0.35,0.14,0.18,0.16,0.03,0.13,13509.0,0.8,{4}{B}{B},"When Dreadhound enters the battlefield, mill three cards.(Put the top three cards of your library into your graveyard.)Whenever a creature dies or a creature card is put into a graveyard from a library, each opponent loses 1 life.",6/6,https://scryfall.com/card/j22/406/dreadhound
501,4.0,Tendrils of Agony,U,Sorcery,0.79,0.25,0.73,0.45,0.04,0.44,13482.0,0.8,{2}{B}{B},"Target player loses 2 life and you gain 2 life.Storm(When you cast this spell, copy it for each spell cast before it this turn. You may choose new targets for the copies.)",,https://scryfall.com/card/sta/34/tendrils-of-agony
502,4.0,Dimir House Guard,C,Creature,0.79,0.63,0.73,0.26,0.03,0.18,13420.0,0.8,{3}{B},"Fear(This creature can’t be blocked except by artifact creatures and/or black creatures.)Sacrifice a creature: Regenerate Dimir House Guard.Transmute{1}{B}{B}({1}{B}{B}, Discard this card: Search your library for a card with the same mana value as this card, reveal it, put it into your hand, then shuffle. Transmute only as a sorcery.)",2/3,https://scryfall.com/card/rav/83/dimir-house-guard
503,1.0,Bone Splinters,C,Sorcery,0.35,0.02,0.11,0.02,0.02,0.15,13414.0,0.8,{B},"As an additional cost to cast this spell, sacrifice a creature.Destroy target creature.",,https://scryfall.com/card/dmu/83/bone-splinters
504,3.0,Crypt Incursion,C,Instant,0.35,0.2,0.11,0.3,0.03,0.34,13352.0,0.8,{2}{B},Exile all creature cards from target player’s graveyard. You gain 3 life for each card exiled this way.,,https://scryfall.com/card/ltc/198/crypt-incursion
505,4.0,Mandate of Abaddon,R,Sorcery,1.49,1.5,1.47,0.67,,0.47,13306.0,0.8,{3}{B},Choose target creature you control. Destroy all creatures with power less than that creature’s power.,,https://scryfall.com/card/40k/40/mandate-of-abaddon
506,2.0,"Miara, Thorn of the Glade",U,Creature,0.35,0.11,0.18,0.14,0.04,0.08,13292.0,0.8,{1}{B},"Whenever Miara, Thorn of the Glade or another Elf you control dies, you may pay{1}and 1 life. If you do, draw a card.Partner(You can have two commanders if both have partner.)",1/2,https://scryfall.com/card/khc/51/miara-thorn-of-the-glade
507,6.0,Asmodeus the Archfiend,R,Creature,0.49,0.19,0.26,0.28,0.02,0.3,13280.0,0.8,{4}{B}{B},"Binding Contract— If you would draw a card, exile the top card of your library face down instead.{B}{B}{B}: Draw seven cards.{B}: Return all cards exiled with Asmodeus the Archfiend to their owner’s hand and you lose that much life.",6/6,https://scryfall.com/card/afr/88/asmodeus-the-archfiend
508,4.0,Fell Specter,U,Creature,0.79,0.27,0.73,0.25,0.03,0.2,13271.0,0.8,{3}{B},"FlyingWhen Fell Specter enters the battlefield, target opponent discards a card.Whenever an opponent discards a card, that player loses 2 life.",1/3,https://scryfall.com/card/jmp/233/fell-specter
509,3.0,Nest of Scarabs,U,Enchantment,0.69,0.31,0.73,0.26,0.03,0.26,13253.0,0.8,{2}{B},"Whenever you put one or more -1/-1 counters on a creature, create that many 1/1 black Insect creature tokens.",,https://scryfall.com/card/akr/117/nest-of-scarabs
510,3.0,Archghoul of Thraben,U,Creature,0.35,0.18,0.18,0.18,0.03,0.12,13189.0,0.8,{2}{B},"Whenever Archghoul of Thraben or another Zombie you control dies, look at the top card of your library. If it’s a Zombie card, you may reveal it and put it into your hand. If you don’t put the card into your hand, you may put it into your graveyard.",3/2,https://scryfall.com/card/dbl/360/archghoul-of-thraben
511,2.0,Dead Man's Chest,R,Enchantment,0.49,0.3,0.55,0.25,0.02,0.19,13189.0,0.8,{1}{B},"Enchant creature an opponent controlsWhen enchanted creature dies, exile cards equal to its power from the top of its owner’s library. You may cast spells from among those cards for as long as they remain exiled, and mana of any type can be spent to cast them.",,https://scryfall.com/card/afc/97/dead-mans-chest
512,5.0,Vat Emergence,U,Sorcery,0.35,0.07,0.18,0.08,0.03,0.19,13165.0,0.8,{4}{B},"Put target creature card from a graveyard onto the battlefield under your control. Proliferate.(Choose any number of permanents and/or players, then give each another counter of each kind already there.)",,https://scryfall.com/card/one/112/vat-emergence
513,1.0,Call to the Netherworld,C,Sorcery,0.59,0.36,0.55,0.21,0.03,0.2,13160.0,0.8,{B},"Return target black creature card from your graveyard to your hand.Madness{0}(If you discard this card, discard it into exile. When you do, cast it for its madness cost or put it into your graveyard.)",,https://scryfall.com/card/c19/108/call-to-the-netherworld
514,5.0,Angel of Suffering,M,Creature,1.99,1.13,2.2,1.03,0.06,0.28,13128.0,0.8,{3}{B}{B},"FlyingIf damage would be dealt to you, prevent that damage and mill twice that many cards.",5/3,https://scryfall.com/card/snc/67/angel-of-suffering
515,3.0,"Armix, Filigree Thrasher",U,Creature,0.35,0.05,0.18,0.16,0.04,0.28,13073.0,0.8,{2}{B},"Whenever Armix, Filigree Thrasher attacks, you may discard a card. When you do, target creature defending player controls gets -X/-X until end of turn, where X is the number of artifacts you control plus the number of artifact cards in your graveyard.Partner(You can have two commanders if both have partner.)",3/2,https://scryfall.com/card/brc/103/armix-filigree-thrasher
516,2.0,Crypt Sliver,C,Creature,0.39,0.37,0.11,0.22,0.04,0.48,13042.0,0.8,{1}{B},All Slivers have “{T}: Regenerate target Sliver.”,1/1,https://scryfall.com/card/cmm/863/crypt-sliver
517,4.0,Henrika Domnathi,M,Creature,1.49,1.28,,,0.17,0.28,13021.0,0.8,{2}{B}{B},"FlyingAt the beginning of combat on your turn, choose one that hasn’t been chosen —• Each player sacrifices a creature.• You draw a card and you lose 1 life.• Transform Henrika Domnathi.",1/3,https://scryfall.com/card/dbl/386/henrika-domnathi-henrika-infernal-seer
518,1.0,Persistent Specimen,C,Creature,0.35,0.09,0.11,0.12,0.03,0.11,12998.0,0.8,{B},{2}{B}: Return Persistent Specimen from your graveyard to the battlefield tapped.,1/1,https://scryfall.com/card/dbl/392/persistent-specimen
519,2.0,Rat Colony,C,Creature,4.49,4.33,5.15,2.59,0.03,0.28,12982.0,0.8,{1}{B},Rat Colony gets +1/+0 for each other Rat you control.A deck can have any number of cards named Rat Colony.,2/1,https://scryfall.com/card/plist/677/rat-colony
520,1.0,Echoing Return,C,Sorcery,0.35,0.08,0.11,0.1,0.03,0.16,12932.0,0.8,{B},Return target creature card and all other cards with the same name as that card from your graveyard to your hand.,,https://scryfall.com/card/j21/320/echoing-return
521,5.0,Archpriest of Shadows,R,Creature,0.49,0.32,0.26,0.2,0.02,0.0,12904.0,0.8,{3}{B}{B},"Backup 1(When this creature enters the battlefield, put a +1/+1 counter on target creature. If that’s another creature, it gains the following abilities until end of turn.)DeathtouchWhenever this creature deals combat damage to a player or battle, return target creature card from your graveyard to the battlefield.",4/4,https://scryfall.com/card/mom/89/archpriest-of-shadows
522,1.0,Innocent Blood,C,Sorcery,0.35,0.17,0.11,0.13,0.04,0.4,12893.0,0.7,{B},Each player sacrifices a creature.,,https://scryfall.com/card/jmp/244/innocent-blood
523,5.0,Ghouls' Night Out,R,Sorcery,0.69,0.36,0.55,0.44,,0.36,12880.0,0.7,{3}{B}{B},"For each player, choose a creature card in that player’s graveyard. Put those cards onto the battlefield under your control. They’re black Zombies in addition to their other colors and types and they gain decayed.(A creature with decayed can’t block. When it attacks, sacrifice it at end of combat.)",,https://scryfall.com/card/mic/19/ghouls-night-out
524,4.0,Raiders' Wake,U,Enchantment,0.59,0.36,0.73,0.24,0.03,0.31,12852.0,0.7,{3}{B},"Whenever an opponent discards a card, that player loses 2 life.Raid— At the beginning of your end step, if you attacked this turn, target opponent discards a card.",,https://scryfall.com/card/xln/116/raiders-wake
525,5.0,Death Tyrant,R,Creature,1.79,1.32,2.2,1.55,,0.15,12830.0,0.7,{4}{B},"MenaceNegative Energy Cone— Whenever an attacking creature you control or a blocking creature an opponent controls dies, create a 2/2 black Zombie creature token.{5}{B}: Return Death Tyrant from your graveyard to the battlefield tapped.",4/6,https://scryfall.com/card/afc/23/death-tyrant
526,1.0,Fatal Push,U,Instant,1.99,1.74,2.57,1.61,0.45,0.14,12823.0,0.7,{B},Destroy target creature if it has mana value 2 or less.Revolt— Destroy that creature if it has mana value 4 or less instead if a permanent you controlled left the battlefield this turn.,,https://scryfall.com/card/klr/84/fatal-push
527,3.0,Behind the Scenes,U,Enchantment,0.35,0.2,0.18,0.15,0.03,0.18,5686.0,0.7,{2}{B},Creatures you control have skulk.(They can’t be blocked by creatures with greater power.){4}{W}: Creatures you control get +1/+1 until end of turn.,,https://scryfall.com/card/soi/100/behind-the-scenes
528,6.0,Reaper from the Abyss,M,Creature,1.79,0.97,2.2,1.02,0.02,0.58,12696.0,0.7,{3}{B}{B}{B},"FlyingMorbid— At the beginning of each end step, if a creature died this turn, destroy target non-Demon creature.",6/6,https://scryfall.com/card/j22/458/reaper-from-the-abyss
529,4.0,Marchesa's Decree,U,Enchantment,2.79,3.53,2.94,2.39,0.21,0.12,12692.0,0.7,{3}{B},"When Marchesa’s Decree enters the battlefield, you become the monarch.Whenever a creature attacks you or a planeswalker you control, that creature’s controller loses 1 life.",,https://scryfall.com/card/pz2/20/marchesas-decree
530,5.0,Street Wraith,U,Creature,0.35,0.12,0.11,0.13,0.05,0.12,12680.0,0.7,{3}{B}{B},"Swampwalk(This creature can’t be blocked as long as defending player controls a Swamp.)Cycling—Pay 2 life.(Pay 2 life, Discard this card: Draw a card.)",3/4,https://scryfall.com/card/dmr/102/street-wraith
531,2.0,Doomed Dissenter,C,Creature,0.35,0.03,0.11,0.04,0.03,0.06,12660.0,0.7,{1}{B},"When Doomed Dissenter dies, create a 2/2 black Zombie creature token.",1/1,https://scryfall.com/card/j22/402/doomed-dissenter
532,5.0,"Chainer, Dementia Master",R,Creature,0.49,0.14,0.26,0.15,0.02,0.44,12607.0,0.7,{3}{B}{B},"All Nightmares get +1/+1.{B}{B}{B}, Pay 3 life: Put target creature card from a graveyard onto the battlefield under your control. That creature is black and is a Nightmare in addition to its other creature types.When Chainer, Dementia Master leaves the battlefield, exile all Nightmares.",3/3,https://scryfall.com/card/cmm/144/chainer-dementia-master
533,2.0,Asylum Visitor,R,Creature,0.49,0.22,0.55,0.39,0.02,0.06,12589.0,0.7,{1}{B},"At the beginning of each player’s upkeep, if that player has no cards in hand, you draw a card and you lose 1 life.Madness{1}{B}(If you discard this card, discard it into exile. When you do, cast it for its madness cost or put it into your graveyard.)",3/1,https://scryfall.com/card/j21/286/asylum-visitor
534,5.0,Invoke Despair,R,Sorcery,0.49,0.37,0.55,0.67,0.36,0.91,12577.0,0.7,{1}{B}{B}{B}{B},"Target opponent sacrifices a creature. If they can’t, they lose 2 life and you draw a card. Then repeat this process for an enchantment and a planeswalker.",,https://scryfall.com/card/neo/101/invoke-despair
535,4.0,Make an Example,R,Sorcery,0.99,1.12,1.1,0.78,,0.44,12562.0,0.7,{3}{B},"Each opponent separates the creatures they control into two piles. For each opponent, you choose one of their piles. Each opponent sacrifices the creatures in their chosen pile.(Piles can be empty.)",,https://scryfall.com/card/ncc/37/make-an-example
536,2.0,Forever Young,C,Sorcery,0.35,0.12,0.11,0.15,0.03,0.08,12553.0,0.7,{1}{B},Put any number of target creature cards from your graveyard on top of your library.Draw a card.,,https://scryfall.com/card/eld/89/forever-young
537,3.0,Unspeakable Symbol,U,Enchantment,2.79,2.55,2.94,1.27,0.04,0.11,12550.0,0.7,{1}{B}{B},Pay 3 life: Put a +1/+1 counter on target creature.,,https://scryfall.com/card/scg/79/unspeakable-symbol
538,3.0,Doomsday,M,Sorcery,4.49,3.28,4.05,2.75,6.31,1.28,12530.0,0.7,{B}{B}{B},"Search your library and graveyard for five cards and exile the rest. Put the chosen cards on top of your library in any order. You lose half your life, rounded up.",,https://scryfall.com/card/plist/842/doomsday
539,1.0,Thieves' Guild Enforcer,R,Creature,0.59,0.22,0.55,0.42,0.06,0.34,12504.0,0.7,{B},"FlashWhenever Thieves’ Guild Enforcer or another Rogue enters the battlefield under your control, each opponent mills two cards.As long as an opponent has eight or more cards in their graveyard, Thieves’ Guild Enforcer gets +2/+1 and has deathtouch.",1/1,https://scryfall.com/card/m21/125/thieves-guild-enforcer
540,4.0,"Josu Vess, Lich Knight",R,Creature,0.49,0.13,0.26,0.1,0.02,0.13,12416.0,0.7,{2}{B}{B},"Kicker{5}{B}(You may pay an additional{5}{B}as you cast this spell.)MenaceWhen Josu Vess, Lich Knight enters the battlefield, if it was kicked, create eight 2/2 black Zombie Knight creature tokens with menace.",4/5,https://scryfall.com/card/moc/253/josu-vess-lich-knight
541,4.0,New Blood,R,Sorcery,1.99,1.13,2.2,1.73,0.1,0.45,12412.0,0.7,{2}{B}{B},"As an additional cost to cast this spell, tap an untapped Vampire you control.Gain control of target creature. Change the text of that creature by replacing all instances of one creature type with Vampire.",,https://scryfall.com/card/lcc/202/new-blood
542,6.0,Demonlord Belzenlok,R,Creature,0.49,0.25,0.26,0.23,0.02,0.45,12364.0,0.7,{4}{B}{B},"Flying, trampleWhen Demonlord Belzenlok enters the battlefield, exile cards from the top of your library until you exile a nonland card, then put that card into your hand. If the card’s mana value is 4 or greater, repeat this process. Demonlord Belzenlok deals 1 damage to you for each card put into your hand this way.",6/6,https://scryfall.com/card/cmm/151/demonlord-belzenlok
543,15.0,Shadow of Mortality,R,Creature,0.69,0.26,0.55,0.32,0.01,0.14,12342.0,0.7,{13}{B}{B},"If your life total is less than your starting life total, this spell costs{X}less to cast, where X is the difference.",7/7,https://scryfall.com/card/snc/94/shadow-of-mortality
544,2.0,Frogtosser Banneret,C,Creature,0.35,0.16,0.11,0.17,0.03,0.18,12334.0,0.7,{1}{B},HasteGoblin spells and Rogue spells you cast cost{1}less to cast.,1/1,https://scryfall.com/card/znc/43/frogtosser-banneret
545,2.0,The Raven Man,R,Creature,0.49,0.25,0.26,0.15,0.01,0.26,12323.0,0.7,{1}{B},"At the beginning of each end step, if a player discarded a card this turn, create a 1/1 black Bird creature token with flying and “This creature can’t block.”{3}{B},{T}: Each opponent discards a card. Activate only as a sorcery.",2/1,https://scryfall.com/card/dmu/103/the-raven-man
546,5.0,Great Unclean One,R,Creature,1.79,0.88,1.84,0.99,,0.23,12293.0,0.7,{4}{B},"Reverberating Summons— At the beginning of your end step, each opponent loses 2 life. Then for each opponent who has less life than you, create a 1/3 black Demon creature token named Plaguebearer of Nurgle.",4/5,https://scryfall.com/card/40k/35/great-unclean-one
547,1.0,Foulmire Knight,U,Creature,0.35,0.1,,,0.02,0.14,12283.0,0.7,{B},Deathtouch,1/1,https://scryfall.com/card/moc/249/foulmire-knight-profane-insight
548,2.0,Glistening Oil,R,Enchantment,6.99,5.47,6.26,3.66,0.02,0.81,12274.0,0.7,{B}{B},"Enchant creatureEnchanted creature has infect.At the beginning of your upkeep, put a -1/-1 counter on enchanted creature.When Glistening Oil is put into a graveyard from the battlefield, return Glistening Oil to its owner’s hand.",,https://scryfall.com/card/nph/62/glistening-oil
549,2.0,Necrogen Communion,U,Enchantment,0.35,0.12,0.18,0.13,0.03,0.06,12268.0,0.7,{1}{B},"Enchant creature you controlEnchanted creature has toxic 2.(Players dealt combat damage by it also get two poison counters.)When enchanted creature dies, return that card to the battlefield under your control.",,https://scryfall.com/card/one/99/necrogen-communion
550,5.0,Murderous Cut,U,Instant,0.59,0.26,0.55,0.2,0.03,0.07,12241.0,0.7,{4}{B},Delve(Each card you exile from your graveyard while casting this spell pays for{1}.)Destroy target creature.,,https://scryfall.com/card/plist/105/murderous-cut
551,1.0,Blood Celebrant,C,Creature,1.29,0.85,1.1,0.4,0.04,0.15,12139.0,0.7,{B},"{B}, Pay 1 life: Add one mana of any color.",1/1,https://scryfall.com/card/lgn/61/blood-celebrant
552,6.0,Blood Tribute,R,Sorcery,2.29,2.0,2.2,1.01,0.02,0.53,12089.0,0.7,{4}{B}{B},"Kicker—Tap an untapped Vampire you control.(You may tap a Vampire you control in addition to any other costs as you cast this spell.)Target opponent loses half their life, rounded up. If this spell was kicked, you gain life equal to the life lost this way.",,https://scryfall.com/card/c17/100/blood-tribute
553,4.0,Mindslicer,R,Creature,0.49,0.25,0.26,0.36,0.02,1.31,12039.0,0.7,{2}{B}{B},"When Mindslicer dies, each player discards their hand.",4/3,https://scryfall.com/card/dmr/91/mindslicer
554,1.0,Sacrifice,U,Instant,3.49,3.33,2.2,2.22,,0.22,12037.0,0.7,{B},"As an additional cost to cast this spell, sacrifice a creature.Add an amount of{B}equal to the sacrificed creature’s mana value.",,https://scryfall.com/card/30a/121/sacrifice
555,5.0,Coveted Prize,R,Sorcery,0.49,0.25,0.26,0.18,0.02,0.08,11983.0,0.7,{4}{B},"This spell costs{1}less to cast for each creature in your party.(Your party consists of up to one each of Cleric, Rogue, Warrior, and Wizard.)Search your library for a card, put it into your hand, then shuffle. If you have a full party, you may cast a spell with mana value 4 or less from your hand without paying its mana cost.",,https://scryfall.com/card/znr/95/coveted-prize
556,2.0,"Gollum, Patient Plotter",U,Creature,0.35,0.06,0.18,0.07,0.03,0.31,11983.0,0.7,{1}{B},"When Gollum, Patient Plotter leaves the battlefield, the Ring tempts you.{B}, Sacrifice a creature: Return Gollum from your graveyard to your hand. Activate only as a sorcery.",3/1,https://scryfall.com/card/ltr/84/gollum-patient-plotter
557,5.0,Bloodlord of Vaasgoth,M,Creature,0.99,0.37,0.73,0.51,0.02,0.18,11975.0,0.7,{3}{B}{B},"Bloodthirst 3(If an opponent was dealt damage this turn, this creature enters the battlefield with three +1/+1 counters on it.)FlyingWhenever you cast a Vampire creature spell, it gains bloodthirst 3.",3/3,https://scryfall.com/card/voc/121/bloodlord-of-vaasgoth
558,3.0,Crypt Rats,U,Creature,0.69,0.31,0.73,0.15,0.76,0.33,11947.0,0.7,{2}{B},{X}: Crypt Rats deals X damage to each creature and each player. Spend only black mana on X.,1/1,https://scryfall.com/card/j22/392/crypt-rats
559,4.0,Ravenloft Adventurer,R,Creature,0.49,0.18,0.26,0.62,1.21,0.29,11918.0,0.7,{3}{B},"When Ravenloft Adventurer enters the battlefield, you take the initiative.If a creature an opponent controls would die, instead exile it and put a hit counter on it.Whenever Ravenloft Adventurer attacks, if you’ve completed a dungeon, defending player loses 1 life for each card they own in exile with a hit counter on it.",3/4,https://scryfall.com/card/clb/142/ravenloft-adventurer
560,5.0,Overwhelming Remorse,C,Instant,0.39,0.07,0.11,0.14,0.03,0.11,11913.0,0.7,{4}{B},This spell costs{1}less to cast for each creature card in your graveyard.Exile target creature or planeswalker.,,https://scryfall.com/card/bro/110/overwhelming-remorse
561,1.0,Whisper of the Dross,C,Instant,0.35,0.1,0.11,0.19,0.03,0.07,11897.0,0.7,{B},"Target creature gets -1/-1 until end of turn. Proliferate.(Choose any number of permanents and/or players, then give each another counter of each kind already there.)",,https://scryfall.com/card/one/117/whisper-of-the-dross
562,1.0,Cultist of the Absolute,R,Enchantment,0.49,0.15,0.26,0.2,,0.25,11892.0,0.7,{B},"Commander creatures you own get +3/+3 and have flying, deathtouch, “Ward—Pay 3 life,” and “At the beginning of your upkeep, sacrifice a creature.”",,https://scryfall.com/card/clb/123/cultist-of-the-absolute
563,3.0,"Taborax, Hope's Demise",U,Creature,0.35,0.11,0.18,0.1,0.02,0.21,11877.0,0.7,{2}{B},"FlyingTaborax, Hope’s Demise has lifelink as long as it has five or more +1/+1 counters on it.Whenever another nontoken creature you control dies, put a +1/+1 counter on Taborax. If that creature was a Cleric, you may draw a card. If you do, you lose 1 life.",2/2,https://scryfall.com/card/cmm/189/taborax-hopes-demise
564,2.0,Mire in Misery,U,Sorcery,0.59,0.31,0.73,0.25,1.03,0.42,11801.0,0.7,{1}{B},Each opponent sacrifices a creature or enchantment.,,https://scryfall.com/card/c19/19/mire-in-misery
565,5.0,Lich-Knights' Conquest,R,Sorcery,0.79,1.3,0.73,0.58,0.01,0.31,11770.0,0.7,{4}{B},"Sacrifice any number of artifacts, enchantments, and/or tokens. Return that many creature cards from your graveyard to the battlefield.",,https://scryfall.com/card/woe/96/lich-knights-conquest
566,4.0,"Kalitas, Traitor of Ghet",M,Creature,7.99,4.98,8.84,8.29,0.3,0.44,11710.0,0.7,{2}{B}{B},"LifelinkIf a nontoken creature an opponent controls would die, instead exile that card and create a 2/2 black Zombie creature token.{2}{B}, Sacrifice another Vampire or Zombie: Put two +1/+1 counters on Kalitas, Traitor of Ghet.",3/4,https://scryfall.com/card/ea1/5/kalitas-traitor-of-ghet
567,4.0,Sorin the Mirthless,M,Planeswalker,5.99,3.63,6.26,7.1,0.87,0.22,11660.0,0.7,{2}{B}{B},"+1: Look at the top card of your library. You may reveal that card and put it into your hand. If you do, you lose life equal to its mana value.−2: Create a 2/3 black Vampire creature token with flying and lifelink.−7: Sorin the Mirthless deals 13 damage to any target. You gain 13 life.",Loyalty: 4,https://scryfall.com/card/dbl/398/sorin-the-mirthless
568,2.0,Mire Triton,C,Creature,0.35,0.06,0.11,0.12,0.03,0.02,11651.0,0.7,{1}{B},"DeathtouchWhen Mire Triton enters the battlefield, mill two cards and you gain 2 life.",2/1,https://scryfall.com/card/cmm/174/mire-triton
569,3.0,Claim the Precious,C,Sorcery,0.35,0.08,0.11,0.08,0.03,0.09,11640.0,0.7,{1}{B}{B},Destroy target creature. The Ring tempts you.,,https://scryfall.com/card/ltr/81/claim-the-precious
570,4.0,Sling-Gang Lieutenant,U,Creature,0.49,0.23,0.55,0.19,0.03,0.32,11573.0,0.7,{3}{B},"When Sling-Gang Lieutenant enters the battlefield, create two 1/1 red Goblin creature tokens.Sacrifice a Goblin: Target player loses 1 life and you gain 1 life.",1/1,https://scryfall.com/card/j22/469/sling-gang-lieutenant
